name,main_category,image,actual_price
Gramiyum Cold Pressed/Wood Pressed Coconut Oil (500 ml),grocery & gourmet foods,https://m.media-amazon.com/images/I/415IGNg-xkL._AC_UL320_.jpg,200.0
"Oceans Secret - Tuna Chunks in Olive Oil 180g, Pack of 2 | Immunity Booster | Superfood | 100% Olive Oil | No Added Water",grocery & gourmet foods,https://m.media-amazon.com/images/I/81-2HcG+oDL._AC_UL320_.jpg,360.0
"Del Monte Tomato Ketchup, Classic Blend, 200g",grocery & gourmet foods,https://m.media-amazon.com/images/I/81yX5k76vYL._AC_UL320_.jpg,40.0
Shapen You 28 Days Slim Blend for Improved Digestion and Weight Management: 2 Pack of Green Tea and Green Coffee (100g each),grocery & gourmet foods,https://m.media-amazon.com/images/I/51DYFLYg9nL._AC_UL320_.jpg,2000.0
G-Uncle-G White Phenyl Concentrate 1 litre makes 30-35 litre of Good phenyl,grocery & gourmet foods,https://m.media-amazon.com/images/I/51RG+BwCPnL._AC_UL320_.jpg,700.0
"Zenith Nutrition Pantothenic Acid (Vitamin B5) 5000mcg, Energy & Metabolism - 100 Veg capsules",grocery & gourmet foods,https://m.media-amazon.com/images/I/514w8HOK2bL._AC_UL320_.jpg,800.0
Catch Whole Jeera (Cumin) Seed 200 GMS - Pack of 2(400 GMS) - Whole Pack,grocery & gourmet foods,https://m.media-amazon.com/images/I/61rijhh2l1L._AC_UL320_.jpg,270.0
SDS Shahi Paneer Masala 40gm - Pack of 6,grocery & gourmet foods,https://m.media-amazon.com/images/I/51+XMc1gaiL._AC_UL320_.jpg,240.0
"Sindhi Dry Fruits Gurbandi Badam, Premium Gurbandi Almond Giri, Desi Badam, Great Snack for Diabetic Patients, 500 grams Pack",grocery & gourmet foods,https://m.media-amazon.com/images/I/91Ge9pCG9sL._AC_UL320_.jpg,624.0
Baidyanath Gulkand - Enriched with Prawal Sun-cooked Indian (Rose Petal Jam) - (200gram),grocery & gourmet foods,https://m.media-amazon.com/images/I/61rQIgdxKSL._AC_UL320_.jpg,150.0
"Organic Tattva 'Fenugreek Powder' | Indian Spice, Fresh Natural Methi Powder (100G, Pouch)",grocery & gourmet foods,https://m.media-amazon.com/images/I/71IZmX-xHNL._AC_UL320_.jpg,40.0
Vaidyarajindia Pure AYURVEDA Olive Salt (Jaitun Ka Namak Zaitoon) 60g,grocery & gourmet foods,https://m.media-amazon.com/images/I/41kSLsywjnL._AC_UL320_.jpg,399.0
NUTRIFRUITS ROASTED CASHEW BLACK PEPPER FLAVOUR,grocery & gourmet foods,https://m.media-amazon.com/images/I/81IJI4DKCML._AC_UL320_.jpg,475.0
"Isha Vasyam A2 Ghee Desi Gir Cow's Vedic Traditional Grassfed Ghee, 500ml",grocery & gourmet foods,https://m.media-amazon.com/images/I/71X7aLpCmYL._AC_UL320_.jpg,1800.0
Nuts and Seeds (Yellow Dates/ Peela Khajoor 1kg),grocery & gourmet foods,https://m.media-amazon.com/images/I/31gUXzqkPOL._AC_UL320_.jpg,2000.0
Add me Home Made Lasode Gunda Pickle Achar 500gm Rajasthani lasoda Fruit ka achaar Glass Jar,grocery & gourmet foods,https://m.media-amazon.com/images/I/61bTZzl0WjL._AC_UL320_.jpg,400.0
RiTrue - Organic Pitted Dried Prunes Without added Sugar - 250 gm - Unsweetened Dry Fruits (No Preservatives & Additives)...,grocery & gourmet foods,https://m.media-amazon.com/images/I/81-MgPc9fGS._AC_UL320_.jpg,499.0
Beyond Snáck Natural Kerala Banana Chips Healthy and Delicious Snacks- No Hand Touch- Original Style Salted 600gms,grocery & gourmet foods,https://m.media-amazon.com/images/I/81RwhQUwH2L._AC_UL320_.jpg,540.0
"Fatafat Digestive Pills , Fatafat Goli , Fatafat Candi , Old Hyderabadi Fatafat (12 pouches x 25g each)",grocery & gourmet foods,https://m.media-amazon.com/images/I/51r4bUbPuGL._AC_UL320_.jpg,222.0
"Vimto Fruit Cordial, 710g",grocery & gourmet foods,https://m.media-amazon.com/images/I/51y+pTxZVUL._AC_UL320_.jpg,999.0
"Nutri Desire Immunity Booster High Rich Protein Combo of Pumpkin, Sunflower & Watermelon Seeds (Pack of 3) (150 gram each)",grocery & gourmet foods,https://m.media-amazon.com/images/I/81Yj9OPaVBS._AC_UL320_.jpg,399.0
CHAI POINT Instant Tea | Incredibly Authentic | Elaichi Flavor | 10 Sachets | Elaichi Tea | Instant Tea Premix Tea| Assam ...,grocery & gourmet foods,https://m.media-amazon.com/images/I/71PjTbZauCL._AC_UL320_.jpg,199.0
"HERBALIFE Afresh Energy Drink - Peach Flavor & Lemon Flavor For Weight Loss Energy Drink  (50 g, Peach, Lemon Flavored)",grocery & gourmet foods,https://m.media-amazon.com/images/I/5185PHr1lEL._AC_UL320_.jpg,1696.0
"Nescafe Gold Origins Indonesian Sumatra Coffee Bottle, 100g",grocery & gourmet foods,https://m.media-amazon.com/images/I/61zqwJipUwL._AC_UL320_.jpg,999.0
Tropicana Mango Delight Fruit Juice - 200ml,grocery & gourmet foods,https://m.media-amazon.com/images/I/61TJ+ii28IL._AC_UL320_.jpg,20.0
Ruchi Daliya 500grm (Pack of 2),grocery & gourmet foods,https://m.media-amazon.com/images/I/71JYTXJaS-L._AC_UL320_.jpg,140.0
"Too Yumm! Multigrain Chips, Dahi Papdi Chaat, 54g",grocery & gourmet foods,https://m.media-amazon.com/images/I/71kctyOY8pS._AC_UL320_.jpg,20.0
"Vishvanetre Pure & Natural Chestnut Oak Flour Shaahabaloot Ka Atta ,Singhra Atta....... (500 GM)",grocery & gourmet foods,https://m.media-amazon.com/images/I/31D6jQrmmoL._AC_UL320_.jpg,498.0
"Urban Platter Baking Soda Jar, 1Kg [Food Grade Sodium Bicarbonate, Perfect for Baking / Cooking / Cleaning, Triple ...",grocery & gourmet foods,https://m.media-amazon.com/images/I/61VG8p6obgL._AC_UL320_.jpg,350.0
"Organic Tattva, Organic Triphala Powder 100 Gram Tin | All Natural,No Artificial Additives Or Harmful Pesticides | for Gas...",grocery & gourmet foods,https://m.media-amazon.com/images/I/81wN1B03u2L._AC_UL320_.jpg,135.0
"Dr. Oetker Funfoods Dr. Oetker Mayo Veg Original, 250g",grocery & gourmet foods,https://m.media-amazon.com/images/I/51Lv4XU2HzL._AC_UL320_.jpg,89.0
JK Urad Dal Bori 200g (Pack of 1) | Beuli Bori | Urad Bari,grocery & gourmet foods,https://m.media-amazon.com/images/I/81lZWem0DfL._AC_UL320_.jpg,98.0
LUCKNOW'S AROURA ACHAR SINCE 1944 Kathal Pickle 400g for Home Use Home Made With Love No Artificial Colors,grocery & gourmet foods,https://m.media-amazon.com/images/I/91uGFZkEB8L._AC_UL320_.jpg,170.0
True Elements Raw Seeds Combo (Chia Seeds 250g and Flax Seeds 250g) - Seeds for Eating | Mix Seeds | High Fibre,grocery & gourmet foods,https://m.media-amazon.com/images/W/IMAGERENDERING_521856-T2/images/I/51SMWRrH3wL._AC_UL320_.jpg,449.0
"Ritter Sport Minis, mini assorted chocolates, Ritter Sport Chocolates mini variety, product of Germany, mini chocolates fo...",grocery & gourmet foods,https://m.media-amazon.com/images/W/IMAGERENDERING_521856-T2/images/I/61zJIkPBxwL._AC_UL320_.jpg,450.0
"Boost Health, Energy and Sports Nutrition Chocolate drink - 1 kg Refill Pack, Fortified with 17 Essential Vitamins and Min...",grocery & gourmet foods,https://m.media-amazon.com/images/W/IMAGERENDERING_521856-T2/images/I/61rXn-pRRfL._AC_UL320_.jpg,490.0
Veganic Marshmallows Pure Veg (80 Pieces) Pack Strawberry Vanilla Flavour Mini Marshmallow Soft And Tasty Candy Perfect Fo...,grocery & gourmet foods,https://m.media-amazon.com/images/W/IMAGERENDERING_521856-T2/images/I/71Un0Y9LS0L._AC_UL320_.jpg,399.0
The Whole Truth - Energy Bars | SUPERSAVER Pack All-Flavours | Pack of 10 x 40g | Dairy Free & Sugarfree | No Artificial S...,grocery & gourmet foods,https://m.media-amazon.com/images/W/IMAGERENDERING_521856-T2/images/I/814Ucf-kxkL._AC_UL320_.jpg,600.0
Thanjai Organics Karuppu Kavuni Rice | Black Rice | Low GI |Traditional Kavuni Arisi (Weight: 1kg),grocery & gourmet foods,https://m.media-amazon.com/images/W/IMAGERENDERING_521856-T2/images/I/819As81ccBL._AC_UL320_.jpg,400.0
"Karachi Bakery Fruit Nankatai Biscuit, 400g",grocery & gourmet foods,https://m.media-amazon.com/images/W/IMAGERENDERING_521856-T2/images/I/71ujxBALktL._AC_UL320_.jpg,215.0
"Amul Kool Koko Can, 200ml",grocery & gourmet foods,https://m.media-amazon.com/images/W/IMAGERENDERING_521856-T2/images/I/81rq-ipykGL._AC_UL320_.jpg,40.0
"Finish Rinse Aid Shine Plus Dry Lemon, 400Ml",grocery & gourmet foods,https://m.media-amazon.com/images/W/IMAGERENDERING_521856-T2/images/I/61VNyQZPV1L._AC_UL320_.jpg,379.0
"True Elements Muesli 1kg - With Seeds, Berries, Raisins & Almonds | 100% Wholegrain Cereal for Breakfast",grocery & gourmet foods,https://m.media-amazon.com/images/W/IMAGERENDERING_521856-T2/images/I/61IiO9pq6jL._AC_UL320_.jpg,595.0
Nestle Nescafe Signature Blend Hot Coffee Premix (1 kg),grocery & gourmet foods,https://m.media-amazon.com/images/W/IMAGERENDERING_521856-T2/images/I/61Jdlc0zPvL._AC_UL320_.jpg,600.0
"FRESH & HONEST Awake Filter Coffee Powder 70: 30 Blend, 200g",grocery & gourmet foods,https://m.media-amazon.com/images/W/IMAGERENDERING_521856-T2/images/I/61FQFw35aJL._AC_UL320_.jpg,110.0
"Regency Pitted Prunes, Dried Plum, 240g",grocery & gourmet foods,https://m.media-amazon.com/images/W/IMAGERENDERING_521856-T2/images/I/51kvJOIbcQL._AC_UL320_.jpg,299.0
"Qonty Defatted Soya Flour | 52% Protein, 1.5% Fat | Lab Tested | 8 gm Protein Per Roti | No Preservatives | Gluten Free | ...",grocery & gourmet foods,https://m.media-amazon.com/images/W/IMAGERENDERING_521856-T2/images/I/71Zh1KDzmTL._AC_UL320_.jpg,455.0
Octavius Classic Assam Black Tea - 100 Teabag pack of 1,grocery & gourmet foods,https://m.media-amazon.com/images/W/IMAGERENDERING_521856-T2/images/I/71rwWDZo-yL._AC_UL320_.jpg,190.0
"Wingreens Farms Peri Peri Ketchup Nozzle Pack, 200 g",grocery & gourmet foods,https://m.media-amazon.com/images/W/IMAGERENDERING_521856-T2/images/I/61ox6QwprpL._AC_UL320_.jpg,75.0
Natureland Organics Coconut Oil 400 Ml - Organic Raw Virgin Oil,grocery & gourmet foods,https://m.media-amazon.com/images/W/IMAGERENDERING_521856-T2/images/I/61uUJfGwhIL._AC_UL320_.jpg,340.0
Nutri Desire Immunity Booster High Rich Protein Chia Seeds (Pack of 2) (150 gram * 2),grocery & gourmet foods,https://m.media-amazon.com/images/W/IMAGERENDERING_521856-T2/images/I/817enVMmWAL._AC_UL320_.jpg,399.0
Mr. Hung Kruanthip Tempura Flour (1 kg),grocery & gourmet foods,https://m.media-amazon.com/images/W/IMAGERENDERING_521856-T2/images/I/71yVfCqz3EL._AC_UL320_.jpg,499.0
"HartBeat Jumbo Love Candy, Mixed Fruit Flavoured, 835 g",grocery & gourmet foods,https://m.media-amazon.com/images/W/IMAGERENDERING_521856-T2/images/I/61WFqBI8zML._AC_UL320_.jpg,167.0
"Pramix Dry Amla Candy, Sweet Avla (Indian Gooseberry) 900 gm",grocery & gourmet foods,https://m.media-amazon.com/images/W/IMAGERENDERING_521856-T2/images/I/61mYo0XlVDL._AC_UL320_.jpg,699.0
"Thanjai Natural Mango Seed Powder (100g) 100% Natural, Made in dried mango seeds Oldest Traditional Method, No Preservatives",grocery & gourmet foods,https://m.media-amazon.com/images/W/IMAGERENDERING_521856-T2/images/I/717dMKFI2+L._AC_UL320_.jpg,250.0
"Colombian Brew 3 in 1 Cappuccino Café Latte, Instant Coffee Powder Premix, 10 Sachets Box pack of 2",grocery & gourmet foods,https://m.media-amazon.com/images/W/IMAGERENDERING_521856-T2/images/I/81bRtEv7+zL._AC_UL320_.jpg,498.0
"Third Wave Coffee French Roast 100% Arabica Coffee, 250 gram (Cold Brew/French Press)",grocery & gourmet foods,https://m.media-amazon.com/images/W/IMAGERENDERING_521856-T2/images/I/81ezwpSmetL._AC_UL320_.jpg,450.0
"Organic Tattva, Organic Roasted Chana Dal, 500g | 100% Vegan, Gluten Free and NO Additives",grocery & gourmet foods,https://m.media-amazon.com/images/I/712LdSFes4L._AC_UL320_.jpg,145.0
"Tropicana Mixed Fruit Juice, 1 Litre",grocery & gourmet foods,https://m.media-amazon.com/images/I/714kIox4UzL._AC_UL320_.jpg,144.0
"Diabexy Cookies Combo (Almond, Coconut & Chocolate) Sugar Control for Diabetes 200 gm Each (Pack of 3)",grocery & gourmet foods,https://m.media-amazon.com/images/I/716eVFDrCtL._AC_UL320_.jpg,1485.0
"Pravin Pickles Thecha Combo of 9 Pack - Red Chilli Thecha 100g x 3, Kolhapuri Thecha 100g x 3, Green Chilli Thecha 100g x 3",grocery & gourmet foods,https://m.media-amazon.com/images/I/81uv+Wjw54L._AC_UL320_.jpg,270.0
"Organic Tattva, Organic Dried Red Chilli Powder, 100 Gram | Quality Mirchi Powder, Naturally Processed, from Farm Picked F...",grocery & gourmet foods,https://m.media-amazon.com/images/I/81rZ5tqEV4L._AC_UL320_.jpg,60.0
"SAPPHIRE FOODS Organically Grown Hulled Buckwheat Groats Vacuum Packed (Hulled, Raw) (250G)",grocery & gourmet foods,https://m.media-amazon.com/images/I/71cmdxQPGvL._AC_UL320_.jpg,1599.0
"Starbucks Single Origin Sumatra Coffee Dark Roast Coffee Capsule by Nespresso Intensity 10, 55g",grocery & gourmet foods,https://m.media-amazon.com/images/I/51h97sSY9xL._AC_UL320_.jpg,1199.0
"Krishna's Pathar Juice Chatadi - 1000 ml | Dissolve or Break The Stone | Goodness of Pashanbhed, Adulsa, Kutki & Amla | Bl...",grocery & gourmet foods,https://m.media-amazon.com/images/I/91IWCaf3wQL._AC_UL320_.jpg,450.0
"Samyang Carbo Hot Chicken Flavour Raman Cup Noodles, 70mg*4 Pack (Pack of 4) (Imported)",grocery & gourmet foods,https://m.media-amazon.com/images/I/51EN1zzpl8S._AC_UL320_.jpg,540.0
MYFITNESS Natural Peanut Butter Smooth 1250g,grocery & gourmet foods,https://m.media-amazon.com/images/I/6100qh-FAxL._AC_UL320_.jpg,649.0
"Limca Bottle, 600ml",grocery & gourmet foods,https://m.media-amazon.com/images/I/51Un9ITqpTL._AC_UL320_.jpg,40.0
ORGANIC INDIA Tulsi Lemon Ginger Tea - 25 Tea Bags (Pack of 2),grocery & gourmet foods,https://m.media-amazon.com/images/I/61zMwpu26cL._AC_UL320_.jpg,388.0
"Happilo Premium International Healthy Nutmix 350g Value Pack, ‎Almonds, Black Raisins, Cashewnuts, Cranberries, Green Rais...",grocery & gourmet foods,https://m.media-amazon.com/images/I/71nuOQcMNxL._AC_UL320_.jpg,599.0
"Gits Instant Khatta Dhokla Mix, Makes 100 Per Pack, Pure Veg, Instant Indian Snack Mix, 500g",grocery & gourmet foods,https://m.media-amazon.com/images/I/71-+80TPvtL._AC_UL320_.jpg,140.0
NutroActive Keto Atta (1g Net Carb Per Roti ) Extremely Low Carb Flour - 500 gm,grocery & gourmet foods,https://m.media-amazon.com/images/I/61xVN6XoedL._AC_UL320_.jpg,449.0
Herbalife Nutrition F 1 Mango F 3 Protein Powder and Afresh Ginger,grocery & gourmet foods,https://m.media-amazon.com/images/I/61ymy8NJB1L._AC_UL320_.jpg,4476.0
Everlite Indian Tasty Crunchy Edible Roasted Clay | Bhutdo | Khadi | Mitti | Butter Soil Manure | Roasted Nakumatt | Nakum...,grocery & gourmet foods,https://m.media-amazon.com/images/I/81awg7Y3FqL._AC_UL320_.jpg,250.0
Gowardhan Cow Ghee - Pure. 1 Litre,grocery & gourmet foods,https://m.media-amazon.com/images/I/81ACaePTygL._AC_UL320_.jpg,725.0
"Alpenliebe Pop Assorted Lollipop (Orange, Strawberry & Caramel Flavour)-(48 Pieces) Pouch, 384 g",grocery & gourmet foods,https://m.media-amazon.com/images/I/61+lPNRYIjL._AC_UL320_.jpg,300.0
"Teabox Organic Turmeric Ginger Tulsi Green Tea 25 Teabags | For Immunity Boosting, Digestion and Sore Throat | 100% Whole ...",grocery & gourmet foods,https://m.media-amazon.com/images/I/71JuDjP5iYL._AC_UL320_.jpg,239.0
"Pro Nature 100% Organic Almonds, 100g",grocery & gourmet foods,https://m.media-amazon.com/images/I/61DIHW+QxCL._AC_UL320_.jpg,270.0
Haldiram's Kesar Gujiya 400 g X 1 Box (Made with 100% Desi Ghee),grocery & gourmet foods,https://m.media-amazon.com/images/I/71ckqWyiNzL._AC_UL320_.jpg,545.0
"Harveys Flavouring Essence | Biryani, Kewra, Saffron, Cardamom | Pack of 4 | For Biryani, Kheer, Cake, Cookies, Muffins, S...",grocery & gourmet foods,https://m.media-amazon.com/images/I/41JTQcCGEZL._AC_UL320_.jpg,236.0
"Urban Platter Vegan Bengal Mustard Kasundi Sauce, 200g",grocery & gourmet foods,https://m.media-amazon.com/images/I/61jIMk0MzNL._AC_UL320_.jpg,250.0
"Amazon Brand - Jam & Honey Yellow Unicorn Soft Toy, 35 cm",grocery & gourmet foods,https://m.media-amazon.com/images/I/710OnlfmW8L._AC_UL320_.jpg,950.0
"Centre Fresh Mint, Chewy Mints, Spearmint Flavour Candy Pocket Bottle, 33 g",grocery & gourmet foods,https://m.media-amazon.com/images/I/71tnHV1+CuL._AC_UL320_.jpg,50.0
Double Horse Kuruva Rice 5Kg | Cherumani Rice | White Rice | 100% Organic and Natural | Chotta saphed chaaval | Traditiona...,grocery & gourmet foods,https://m.media-amazon.com/images/I/81j7vPaM-DL._AC_UL320_.jpg,310.0
"Urban Platter Nori Komi Furikake Seasoning, 100g (Japanese Style, Vegan, Made with Ao Nori, Sesame Seeds, Pink Salt, Seaso...",grocery & gourmet foods,https://m.media-amazon.com/images/I/71UoOsx4nAL._AC_UL320_.jpg,250.0
"ElectroFizz Instant Hydration Energy Drink for Workout for Men and Women- Electrolyte Powder, Vitamin C, Probiotics - 1 Kg...",grocery & gourmet foods,https://m.media-amazon.com/images/I/71L7Ks2vzWL._AC_UL320_.jpg,777.0
Spice Story Gujarati Tamarind And Date Twister 250g | Imli Khajoor Ki Khatti Meethi Chatpati Chutney| No Artificial Flavor...,grocery & gourmet foods,https://m.media-amazon.com/images/I/71D8myT-r7L._AC_UL320_.jpg,299.0
NatureVit Premium Chia Seeds 200g | Raw Chia Seeds for Eating with Omega 3 & Fibre for Weight Loss Management.,grocery & gourmet foods,https://m.media-amazon.com/images/I/71PRbjlWs0L._AC_UL320_.jpg,300.0
Hugs Motu Patlu Dip Sticks Biscuits 24pcs ( Chocolate Flavour ),grocery & gourmet foods,https://m.media-amazon.com/images/I/61ee7DhfHsL._AC_UL320_.jpg,120.0
"Knorr Soup Hot and Sour Chicken Pouch, 36g",grocery & gourmet foods,https://m.media-amazon.com/images/I/61YarG3bGSL._AC_UL320_.jpg,75.0
Rustic Nature Raw Chia Seeds Rich in Omega 3 for Weight Loss 1kg,grocery & gourmet foods,https://m.media-amazon.com/images/I/71EM9bQN4ZL._AC_UL320_.jpg,1000.0
"Prizex Natural Organic Poppy Seeds / Khus Khus / Posta Dana, 250gm…",grocery & gourmet foods,https://m.media-amazon.com/images/I/61S-VvKlRlL._AC_UL320_.jpg,699.0
Happilo Premium International Daily Super Fitness Mix 325 g | Premium Superfood | Premium & Nutritious Super Fitness Mix N...,grocery & gourmet foods,https://m.media-amazon.com/images/I/71vmhnPeDVL._AC_UL320_.jpg,499.0
SFT Fennel Seeds Small (Saunf) 400 Gm,grocery & gourmet foods,https://m.media-amazon.com/images/I/813VbMx8oCL._AC_UL320_.jpg,300.0
Tajín Clásico Chile Lime Seasoning 5 oz 142g,grocery & gourmet foods,https://m.media-amazon.com/images/I/61M-izdEk-L._AC_UL320_.jpg,999.0
Woolah Rare Assam Green Tea - World's 1st Bagless Whole Leaf Organic Tea Dip | 15 pcs (30 Cups) | Single Origin Tea | Natu...,grocery & gourmet foods,https://m.media-amazon.com/images/I/71f0xF+i3jL._AC_UL320_.jpg,450.0
mCaffeine Green Tea Skin Care Gift Set With Goodness of Vitamin C | For All Ocassions | Gender Neutral | 100% Natural Prod...,grocery & gourmet foods,https://m.media-amazon.com/images/I/612b7uBJ8bL._AC_UL320_.jpg,2049.0
Namo Organics - Jumbo Chironji Seeds - 150 Gm - Almondette Kernels / Charoli Dry Fruits | Raw | Sweets Making,grocery & gourmet foods,https://m.media-amazon.com/images/I/719ysvewuNL._AC_UL320_.jpg,399.0
"Tulsi Rozana California Almonds, 1000gm",grocery & gourmet foods,https://m.media-amazon.com/images/I/71o0f-G71kL._AC_UL320_.jpg,1185.0
Birju Mahavir Kadwa Badam - Bitter Almonds 400 Gr,grocery & gourmet foods,https://m.media-amazon.com/images/I/71CbWL3M4gL._AC_UL320_.jpg,590.0
"Nando's Peri Peri Chilli Sauce - Hot, 250g, Product of The Netherlands",grocery & gourmet foods,https://m.media-amazon.com/images/I/71X53hqHM6L._AC_UL320_.jpg,390.0
"Paperboat Swing Lush Lychee Juice with Vitamin D, 600 ml Each - Pack of 6",grocery & gourmet foods,https://m.media-amazon.com/images/I/61QnDBrezTL._AC_UL320_.jpg,240.0
"Sunbean Beaten Caffe Strong, 125g | Rich, Creamy Strong Beaten Coffee | Whipped Coffee Paste | Strong Instant Beaten Coffe...",grocery & gourmet foods,https://m.media-amazon.com/images/I/71jIELZNhIL._AC_UL320_.jpg,175.0
Cookd Madras 65-100g,grocery & gourmet foods,https://m.media-amazon.com/images/I/51-OrGuXzKL._AC_UL320_.jpg,199.0
"Urban Platter Natural Cocoa Powder, 250g",grocery & gourmet foods,https://m.media-amazon.com/images/I/61ipbLfMcFL._AC_UL320_.jpg,250.0
Nutri Desire Fox Nuts Phool Makhana (1kg),grocery & gourmet foods,https://m.media-amazon.com/images/I/71BZxB2tvvL._AC_UL320_.jpg,999.0
ARNOTT'S Tim TAM Smooth and Crunchy Classic Chocolate Sandwich Biscuit with Selected Cocoa Beans 81GM(Imported),grocery & gourmet foods,https://m.media-amazon.com/images/I/61X25JNQlyL._AC_UL320_.jpg,699.0
Nutraj California Pitted Prunes (Dried Seedless Plums) 400g (200g X 2) | Dried Plum | Seedless | Gluten Free | Non GMO | H...,grocery & gourmet foods,https://m.media-amazon.com/images/I/71lTFan4vZL._AC_UL320_.jpg,498.0
Birju Mahavir Gond Katira - Tragacanth Gum 1 KG,grocery & gourmet foods,https://m.media-amazon.com/images/I/81eU6Qzu4zL._AC_UL320_.jpg,760.0
"Miltop Premium Cardamom Green Whole (ELAICHI), 100g",grocery & gourmet foods,https://m.media-amazon.com/images/I/911YTtqSHLL._AC_UL320_.jpg,500.0
Rungtas Real Gold Special Assam Black Tea - 2 Kg | Strong & Fresh Kadak Chai | India Premium Blended Aromatic Long Leaf Te...,grocery & gourmet foods,https://m.media-amazon.com/images/I/616y8ISJDnL._AC_UL320_.jpg,900.0
"Happy Jars Chocolate Hazelnut Spread, 265g | Real Dark Chocolate | Pure Hazelnuts | 40% less sugar | No added Palm oil | N...",grocery & gourmet foods,https://m.media-amazon.com/images/I/71-OEcmNxCL._AC_UL320_.jpg,399.0
"Agile Organic Whole Cranberry 500g - Cranberries Dry Fruit | Antioxidant Rich, Non-GMO, Gluten Free & Vegan | Healthy Snack",grocery & gourmet foods,https://m.media-amazon.com/images/I/71fbwYjtNBL._AC_UL320_.jpg,650.0
"Taj Mahal Spicy Ginger Tea Bags, 25 Pieces",grocery & gourmet foods,https://m.media-amazon.com/images/I/41YPjwc4HLL._AC_UL320_.jpg,199.0
C.P. Chandubhai Bhanushali Kutchi Dabeli Masala (250gm x 2 Packets=500 gm) (Mandvi-Kutch),grocery & gourmet foods,https://m.media-amazon.com/images/I/41MhZHnHqQL._AC_UL320_.jpg,220.0
"Sprig Roasted Chilli Oil |Crafted with real Bydagi Chilies| No artificial colours, flavor, additives or preservatives | Ve...",grocery & gourmet foods,https://m.media-amazon.com/images/I/8136O7AA3QL._AC_UL320_.jpg,399.0
"Tata Agni Tea, Dust, 250g",grocery & gourmet foods,https://m.media-amazon.com/images/I/51+1VxPKzyL._AC_UL320_.jpg,65.0
"Tong Garden Sunflower BBQ Seeds, 30g, Pack of 12",grocery & gourmet foods,https://m.media-amazon.com/images/I/71r21XE8bHL._AC_UL320_.jpg,360.0
"HERBALIFE Afresh Energy Drink - Cinnamon Flavor & Tulsi Flavor For Weight Loss Energy Drink  (50 g, Cinnamon, Tulsi Flavored)",grocery & gourmet foods,https://m.media-amazon.com/images/I/51n2SE1yWHS._AC_UL320_.jpg,1696.0
"Urban Platter Maca Root Powder, 150g",grocery & gourmet foods,https://m.media-amazon.com/images/I/61werE-UvYL._AC_UL320_.jpg,800.0
"DOBIEE Fruit Flavoured Centre Filled Candies Combo Pack of 4 (My Toy & Joy - Assorted, Muskiee - 50 Candies, Don Masti - 5...",grocery & gourmet foods,https://m.media-amazon.com/images/I/71K-2byYSsL._AC_UL320_.jpg,250.0
Tosca Muso Gold Chocolate- Gold Chocolate Truffles- Center Filled Milk Chocolate (60 pcs in a Box),grocery & gourmet foods,https://m.media-amazon.com/images/I/51YNeiQ4v+L._AC_UL320_.jpg,299.0
TE-A-ME Unwind Pure Chamomile | Herbal Infusion Tea | Chamomile Flowers | Subtle & Flowery | Light & Gentle Taste | Stres...,grocery & gourmet foods,https://m.media-amazon.com/images/I/418gs9IDR7S._AC_UL320_.jpg,700.0
SFT Fennel Seeds Big (Saunf) 200 Gm,grocery & gourmet foods,https://m.media-amazon.com/images/I/813LkZcIOeL._AC_UL320_.jpg,245.0
Vikram Kadak Dust Tea | Kadak Taste & Damdaar Strength | Aromatic & Rich Tea Powder - 500g Pouch,grocery & gourmet foods,https://m.media-amazon.com/images/I/51cHAx+93+L._AC_UL320_.jpg,238.0
Pro Nature Organic Cold Pressed Sunflower Oil 1 Liter,grocery & gourmet foods,https://m.media-amazon.com/images/I/51HYlEQdQ1L._AC_UL320_.jpg,479.0
LuvIt Goodies Chocolates Assorted Gift Pack | Diwali Chocolate Gift Set | Best Gift Box for Diwali Celebration | Multipack...,grocery & gourmet foods,https://m.media-amazon.com/images/I/612nOZsEyfL._AC_UL320_.jpg,700.0
Manna iStrong | Chocolate Flavoured Multi Grain Energy Drink 200g (Pack of 2) | Clinically Proven to Tackle Anemia in 90 D...,grocery & gourmet foods,https://m.media-amazon.com/images/I/51wC9XpPaaL._AC_UL320_.jpg,298.0
"Malikaz' The Royale Taste Dry Whole Red Chilli | Lal Mirch Pouch, 100 g | Fiery | 100% Natural | No Additives | Easy to ad...",grocery & gourmet foods,https://m.media-amazon.com/images/I/61dKnjQrwfS._AC_UL320_.jpg,159.0
"Nourcery Pizza & Pasta Seasoning Mix, 400g (Oregano Seasoning)",grocery & gourmet foods,https://m.media-amazon.com/images/I/71naZ9oC1JL._AC_UL320_.jpg,448.0
"Hugo Reitzel Gherkin in Vinegar (American Style Sandwich Stackers), 350g | Pack of 2",grocery & gourmet foods,https://m.media-amazon.com/images/I/81W8pQ-xJbL._AC_UL320_.jpg,330.0
First Bud Organics - Homemade Mango Pickle (350g) | Secret Rajasthani Recipe | Dry and Spicy Pickle | 100% Natural Ingredi...,grocery & gourmet foods,https://m.media-amazon.com/images/I/71I3sqV8d8L._AC_UL320_.jpg,399.0
"Nongshim Shin Kimchi Instant Noodle Cup, 2.65 oz / 75 g",grocery & gourmet foods,https://m.media-amazon.com/images/I/81LSfIHpKdL._AC_UL320_.jpg,109.0
"Kwality Walls Trixy Cheesecake Cup, 110 ml",grocery & gourmet foods,https://m.media-amazon.com/images/I/81X41kN-MUL._AC_UL320_.jpg,70.0
Early Foods Almond Drink Mix 200g|Badam Powder| Kids Drink,grocery & gourmet foods,https://m.media-amazon.com/images/I/71mBb5D0n2L._AC_UL320_.jpg,320.0
"Bharat Honey Agmark Grade 'A' Honey, 500 Grams",grocery & gourmet foods,https://m.media-amazon.com/images/I/81D9KsNpqRL._AC_UL320_.jpg,280.0
"LB RAY 100% Sugar-Free Meetha Paan Mukhwas, After Meal Snack, Mouth Freshener- Made with Natural Plant Sweetener Stevia (1...",grocery & gourmet foods,https://m.media-amazon.com/images/I/61fkFWD2Q6L._AC_UL320_.jpg,299.0
"Tata Sampann Multi Dal Chilla Mix, 180g",grocery & gourmet foods,https://m.media-amazon.com/images/I/61mznvgJ5PL._AC_UL320_.jpg,70.0
"Coco Mama Coconut Water Tetrapak, 250 ml",grocery & gourmet foods,https://m.media-amazon.com/images/I/61SNrwLm7IL._AC_UL320_.jpg,50.0
"Barilla Pasta Linguine Durum Wheat, 500g",grocery & gourmet foods,https://m.media-amazon.com/images/I/514trpA2imL._AC_UL320_.jpg,329.0
"CAPILANO Honey, 500 g",grocery & gourmet foods,https://m.media-amazon.com/images/I/71YG3KputUL._AC_UL320_.jpg,950.0
"Top Ramen Cup Noodles Italiano, 70g",grocery & gourmet foods,https://m.media-amazon.com/images/I/91NtaMEIFoL._AC_UL320_.jpg,50.0
