name,main_category,image,actual_price
"Nutraj 100% Natural Dried Premium California Walnut Kernels, 500g (2 X 250g) | Pure Without Shell Walnut Kernels | Akhrot ...",grocery & gourmet foods,https://m.media-amazon.com/images/I/71f5UPOWDqL._AC_UL320_.jpg,998.0
"Cadbury Bournvita 5 Star Magic Health Drink, 750g Pouch",grocery & gourmet foods,https://m.media-amazon.com/images/I/614FIW5c6HL._AC_UL320_.jpg,353.0
Sugar Free Green Natural Stevia Jar(200 g),grocery & gourmet foods,https://m.media-amazon.com/images/I/61rBhkTJ6EL._AC_UL320_.jpg,170.0
"Daawat Pulav, Long Grains, Fluffy Basmati for finest Pulav, 1 Kg",grocery & gourmet foods,https://m.media-amazon.com/images/I/71UO6eXC1QL._AC_UL320_.jpg,139.0
Tata Tea Gold | Assam teas with Gently Rolled Aromatic Long Leaves | Rich & Aromatic Chai | Black Tea | 500g,grocery & gourmet foods,https://m.media-amazon.com/images/I/51kEujuYlpL._AC_UL320_.jpg,295.0
"Wagh Bakri Premium Leaf Tea, Poly Pack, 500g",grocery & gourmet foods,https://m.media-amazon.com/images/I/61kTHO+UX9L._AC_UL320_.jpg,290.0
"Dabur Vedic Tea - 500gm | Handpicked from Assam, Nilgiri & Darjeeling | Soulful Aroma & Rich Taste | 30+ Ayurvedic Herbs |...",grocery & gourmet foods,https://m.media-amazon.com/images/I/61DMPchFPLL._AC_UL320_.jpg,295.0
"Nescafe Classic Coffee Jar, 200 g with Free Red Mug and Scoop Spoon",grocery & gourmet foods,https://m.media-amazon.com/images/I/71ehfHfPCzL._AC_UL320_.jpg,640.0
BLUE TEA - Chamomile Flower Tea | Pure Whole Flower Buds of Chamomile || SLEEP TEA & STRESS RELIEF || Herbal Tea - Caffein...,grocery & gourmet foods,https://m.media-amazon.com/images/I/71qVgLGta9L._AC_UL320_.jpg,399.0
"Organic Tattva, Organic Wheat Dalia / Daliya, 500g",grocery & gourmet foods,https://m.media-amazon.com/images/I/71a5llM7MBL._AC_UL320_.jpg,55.0
"Mccain Chilli Garlic Potato Bites, 420 g Regular Pack",grocery & gourmet foods,https://m.media-amazon.com/images/I/816voyD8jiL._AC_UL320_.jpg,140.0
"Saffola Honey Gold, 100% Pure NMR Tested Honey, Made with Kashmir Honey, 1Kg",grocery & gourmet foods,https://m.media-amazon.com/images/I/61pVnleyBgL._AC_UL320_.jpg,570.0
"Red Label Natural Care Tea, Chai Made With 5 Ayurvedic Herbs, 1 Kg",grocery & gourmet foods,https://m.media-amazon.com/images/I/615F-HVtwEL._AC_UL320_.jpg,650.0
Kellogg's Chocos Variety Pack 168g | Breakfast Cereal for Kids,grocery & gourmet foods,https://m.media-amazon.com/images/I/71stDXSgbHL._AC_UL320_.jpg,70.0
"Dabur Amla Juice: Rich Source of Vitamin C and Antioxidants for Immunity boosting |Pure, Natural and 100% Ayurvedic Juice -1L",grocery & gourmet foods,https://m.media-amazon.com/images/I/71Dtf-ydPYL._AC_UL320_.jpg,235.0
"Catch Red Chilli Powder, 100g",grocery & gourmet foods,https://m.media-amazon.com/images/I/71qMRn40n9L._AC_UL320_.jpg,73.0
"Pedigree Dentastix Oral Care Dog Treat for Adult Large Breed (25 Kg+), Monthly Pack (28 Sticks) 1.08 Kg",grocery & gourmet foods,https://m.media-amazon.com/images/I/61oEmtyEMmL._AC_UL320_.jpg,1070.0
"Fresh Baby Orange Nagpur, 1kg",grocery & gourmet foods,https://m.media-amazon.com/images/I/71O-5pKLmzL._AC_UL320_.jpg,
"Britannia Milk Bikis Biscuits, 170.5g or 190.5g",grocery & gourmet foods,https://m.media-amazon.com/images/I/81kgnSr+3KL._AC_UL320_.jpg,25.0
"Nescafé Classic Instant Ground Coffee, 200g Stabilo, Bag",grocery & gourmet foods,https://m.media-amazon.com/images/I/71zjeDcWWXL._AC_UL320_.jpg,600.0
"Mother Dairy Pure Healthy Ghee, 1L",grocery & gourmet foods,https://m.media-amazon.com/images/I/91idhnLyJqL._AC_UL320_.jpg,845.0
"Cadbury Dairy Milk Crispello Chocolate Bar, 35 g",grocery & gourmet foods,https://m.media-amazon.com/images/I/615qkjsgv8L._AC_UL320_.jpg,30.0
"TE-A-ME Purify Green Tea, 100 Tea Bags | Green tea bags 100 pcs | Green Tea | Green Tea 100 Tea Bag Pack",grocery & gourmet foods,https://m.media-amazon.com/images/I/71fNICQ+fJL._AC_UL320_.jpg,325.0
"Hershey's Chocolate Syrup, 200g",grocery & gourmet foods,https://m.media-amazon.com/images/I/71Wh7SUgUIL._AC_UL320_.jpg,95.0
"Parle Monaco Classic, 400g",grocery & gourmet foods,https://m.media-amazon.com/images/I/7127Vty6kZL._AC_UL320_.jpg,80.0
"Tata Tea Premium Teaveda | Premium Assam Tea Leaves | With Goodness of Time-tested Indian Ingredients -Tulsi, Elaichi, Gin...",grocery & gourmet foods,https://m.media-amazon.com/images/I/619o61uLbgL._AC_UL320_.jpg,145.0
"Nestlé NAN PRO 4 Follow-Up Formula Powder - After 18 months, Up to 24 months, Stage 4, 400g Bag-In-Box Pack",grocery & gourmet foods,https://m.media-amazon.com/images/I/71axZ7z9LhL._AC_UL320_.jpg,740.0
Dabur Hommade Lemoneez- Goodness of 33 lemons - 250 ml,grocery & gourmet foods,https://m.media-amazon.com/images/I/71cdjcxCeAL._AC_UL320_.jpg,80.0
"Fresh Organic Ginger, 100g",grocery & gourmet foods,https://m.media-amazon.com/images/I/61SCxbFGpWL._AC_UL320_.jpg,22.0
"More Bengal Gram Dal - Roasted, 500g (Loose)",grocery & gourmet foods,https://m.media-amazon.com/images/I/71INJynix0L._AC_UL320_.jpg,150.0
Saffola Active Refined Oil|Blend of Rice Bran Oil & Soyabean Oil|Cooking Oil|Pro Weight Watchers Edible Oil 5 litre Jar,grocery & gourmet foods,https://m.media-amazon.com/images/I/61fL35+n7TL._AC_UL320_.jpg,955.0
Herbalife Nutrition Natural Tulsi Afresh Energy Drink Mix,grocery & gourmet foods,https://m.media-amazon.com/images/I/511W3uA6yzL._AC_UL320_.jpg,848.0
"Thums Up Soft Drink PET Bottle, 2.25 L",grocery & gourmet foods,https://m.media-amazon.com/images/I/61tiR5teCjL._AC_UL320_.jpg,85.0
"Tata Sampann Chaat Masala with Natural Oils, Crafted by Chef Sanjeev Kapoor, 100g",grocery & gourmet foods,https://m.media-amazon.com/images/I/619Dntj9dJL._AC_UL320_.jpg,80.0
"Brooke Bond, Red Label, 100g",grocery & gourmet foods,https://m.media-amazon.com/images/I/51+iVkS0ZVL._AC_UL320_.jpg,30.0
Goodricke Roasted Darjeeling Tea - 250 gm | Whole Leaf Tea | 100% Pure & Original Darjeeling Long Leaf Tea | Flavoury Gold...,grocery & gourmet foods,https://m.media-amazon.com/images/I/61jbZ93NhML._AC_UL320_.jpg,280.0
Glucon-D Instant Energy Health Drink Tangy Orange - 450Gm Refill,grocery & gourmet foods,https://m.media-amazon.com/images/I/71Qgc4wDwVL._AC_UL320_.jpg,173.0
"Sunfeast Dark Fantasy Bourbon Classic With Real Chocolate, 100g",grocery & gourmet foods,https://m.media-amazon.com/images/I/71lmk-WE2OL._AC_UL320_.jpg,40.0
"Amul Chocomini Chocolate, 250 g",grocery & gourmet foods,https://m.media-amazon.com/images/I/71KZQkANkFS._AC_UL320_.jpg,140.0
"Sunfeast Dark Fantasy Choco Nut Fills, 75g | Original Filled Cookies with Nuts",grocery & gourmet foods,https://m.media-amazon.com/images/I/71PFNfK7zhL._AC_UL320_.jpg,40.0
"UPF Healthy Brown Eggs, 6 Pieces| Veg Fed| Non-Fertile Eggs",grocery & gourmet foods,https://m.media-amazon.com/images/I/41dqMrWXmLL._AC_UL320_.jpg,89.0
"Cup Noodles Mazedaar Masala, 70g",grocery & gourmet foods,https://m.media-amazon.com/images/I/91aWJn2W5eL._AC_UL320_.jpg,50.0
"Aashirvaad Sugar Release Control Atta, 5kg Pack, Low GI Atta",grocery & gourmet foods,https://m.media-amazon.com/images/I/81kcZpNNKNS._AC_UL320_.jpg,395.0
"Urban Platter Pink Himalayan Rock Salt Powder Jar, 1.5kg ( Additive-Free, Gourmet Grade, Signature Quality)",grocery & gourmet foods,https://m.media-amazon.com/images/I/71SpDzVLJZL._AC_UL320_.jpg,400.0
"Aashirvaad Nature’s Superfoods Gluten Free Flour, 1kg Pack, Super Nutritious Flour",grocery & gourmet foods,https://m.media-amazon.com/images/I/819vYkT-VHL._AC_UL320_.jpg,210.0
veeba pasta pizza sauce 280g,grocery & gourmet foods,https://m.media-amazon.com/images/I/71eY2jA-pHL._AC_UL320_.jpg,89.0
"Himalayan Natives Unpolished Toor Dal/Arhar Dal/Tur Dal Unpolished 1 kg Pouch, 1000 GM",grocery & gourmet foods,https://m.media-amazon.com/images/I/618I4yT4eiL._AC_UL320_.jpg,219.0
24 Mantra Organic Bajra Flour/Pearl Millet Flour/Sajjalu - 500gms | Pack of 1 | Chemical Free & Pesticides Free | Naturall...,grocery & gourmet foods,https://m.media-amazon.com/images/I/71LtAovHIsL._AC_UL320_.jpg,55.0
Brij Gwala Desi Cow Ghee |Made Traditionally from Curd |Pure Cow Ghee for Better Digestion and Immunity | 1Ltr TetraPack,grocery & gourmet foods,https://m.media-amazon.com/images/I/61ctpFYqLTL._AC_UL320_.jpg,580.0
"Mangalam Camphor tab Pouch (500g Small Round, Pack of 1)",grocery & gourmet foods,https://m.media-amazon.com/images/I/713lj6wLuJL._AC_UL320_.jpg,750.0
"Cup Noodles Veggi Manchow, 70g",grocery & gourmet foods,https://m.media-amazon.com/images/I/91sFWJgCLDL._AC_UL320_.jpg,50.0
"Parle Krackjack, 400g",grocery & gourmet foods,https://m.media-amazon.com/images/I/81VK59CJUXL._AC_UL320_.jpg,75.0
"True Elements Nuts & Berries Muesli 1kg - With 14% Millets, Almonds & Cranberries | High in Fibre | 100% Wholegrain Breakf...",grocery & gourmet foods,https://m.media-amazon.com/images/I/51mow6vx+HL._AC_UL320_.jpg,595.0
"Cadbury Dairy Milk Bites Hazelnut, 40 g",grocery & gourmet foods,https://m.media-amazon.com/images/I/61xUrZc2XtL._AC_UL320_.jpg,75.0
"LG Asafoetida Powder, 100 g",grocery & gourmet foods,https://m.media-amazon.com/images/I/41BRTVTgr2L._AC_UL320_.jpg,165.0
"Sleepy Owl Premium Instant Coffee Sachets | 96 gm - Pack of 48 Assorted Coffee Powder Sachets | 2g Each - Original, French...",grocery & gourmet foods,https://m.media-amazon.com/images/I/61pt8-knI5L._AC_UL320_.jpg,500.0
"Cadbury Silk Valentines Potli Gift Pack, 343 g",grocery & gourmet foods,https://m.media-amazon.com/images/I/71R-oJjH5UL._AC_UL320_.jpg,650.0
"Nature Prime 100% Natural Premium Mix Dry Fruits and Nuts 1 Kg [Almonds, Cashew, Kishmish, Apricot, Black Raisins,kiwi] Dr...",grocery & gourmet foods,https://m.media-amazon.com/images/I/41fnPBnX5UL._AC_UL320_.jpg,1499.0
Tur Dal Loose Selecta 1kg,grocery & gourmet foods,https://m.media-amazon.com/images/I/81zDBFZ8OuL._AC_UL320_.jpg,199.0
"Mccain Veggie Burger, 360 g",grocery & gourmet foods,https://m.media-amazon.com/images/I/81q6FAqIfvL._AC_UL320_.jpg,135.0
Saffola Fittify Himalayan Apple Cider Vinegar with the Mother of Vinegar - 500 ml,grocery & gourmet foods,https://m.media-amazon.com/images/I/712M02gShZL._AC_UL320_.jpg,299.0
"Patanjali Saundarya Aloe Vera Gel, 150ml",grocery & gourmet foods,https://m.media-amazon.com/images/I/71tdCqV6q3L._AC_UL320_.jpg,100.0
"Brooke Bond Red Label Natural Care Tea, 250g Carton",grocery & gourmet foods,https://m.media-amazon.com/images/I/51hdl9zEmGL._AC_UL320_.jpg,130.0
"Organic India Tulsi Original Tea, 25 Infusion Tea Bags ( 1 Bag x 1.74g Each )",grocery & gourmet foods,https://m.media-amazon.com/images/I/51RqD74voHL._AC_UL320_.jpg,168.0
"Aashirvaad Sugar Release Control Atta, 1kg Pack, Low GI (Glycemic Index) Atta for Diabetics, A Blend of Whole Wheat, Pulse...",grocery & gourmet foods,https://m.media-amazon.com/images/I/81kcZpNNKNS._AC_UL320_.jpg,80.0
Himalaya Wellness Pure Herbs Shatavari Women's Wellness | Promotes lactation | - 60 Tablets,grocery & gourmet foods,https://m.media-amazon.com/images/I/61cF+L8aeEL._AC_UL320_.jpg,180.0
Saffola Tasty Refined Oil|Blend of Corn Oil & Rice Bran Oil|Cooking oil|Pro Fitness Conscious Edible Oil 1 Litre Pouch,grocery & gourmet foods,https://m.media-amazon.com/images/I/61URw94UvuL._AC_UL320_.jpg,190.0
"More Whole Masoor Malka - Red, 500g (Loose)",grocery & gourmet foods,https://m.media-amazon.com/images/I/716VAVQvxjL._AC_UL320_.jpg,199.0
"Urban Platter Baker's Active Dry Yeast, 100g",grocery & gourmet foods,https://m.media-amazon.com/images/I/71scYxnHEgL._AC_UL320_.jpg,250.0
"Lipton Honey Lemon Green Tea Bags, 25 Pieces",grocery & gourmet foods,https://m.media-amazon.com/images/I/614Vy2M-YUL._AC_UL320_.jpg,180.0
"Amazon Brand - Vedaka Poppy Seeds (Khus Khus), 200g",grocery & gourmet foods,https://m.media-amazon.com/images/I/91eXmQplbIL._AC_UL320_.jpg,600.0
"Manna Foxtail Millet Natural Grains, 1kg (500g x 2 Packs) - (Kaon/Kang/Kangni/Kakum/Navani/korralu/Korra/Thinai) | Native ...",grocery & gourmet foods,https://m.media-amazon.com/images/I/81+zN8b8ATL._AC_UL320_.jpg,198.0
"ORGANIC INDIA Cold Pressed Virgin Coconut Oil, 500ml (Pack of 1)",grocery & gourmet foods,https://m.media-amazon.com/images/I/71TAyjyYmyL._AC_UL320_.jpg,725.0
"Paper Boat Panipuri Pellets I Hygienic & Tasty I Ready to Fry I Golgappe, 400g",grocery & gourmet foods,https://m.media-amazon.com/images/I/61TWHgzjIDL._AC_UL320_.jpg,200.0
"Tata Sampann 6 Grain Khichdi Mix, Instant Ready to Cook Mix, 180g",grocery & gourmet foods,https://m.media-amazon.com/images/I/71rk3rEXO4S._AC_UL320_.jpg,70.0
"Sunfeast YiPPee! Pasta Treat | Cheesy and Soft Suji, Rawa Pasta | Tomato Cheese | 65g Pack",grocery & gourmet foods,https://m.media-amazon.com/images/I/8193nBUmmRL._AC_UL320_.jpg,28.0
"Lifelong LLM99 Foot, Calf and Leg Massager, (With Heat and Vibration), 80W, 4 Motors, Dark Brown",grocery & gourmet foods,https://m.media-amazon.com/images/I/61qRYAGbVJL._AC_UL320_.jpg,38000.0
Manna Kodo Millet | Kodri | Natural Grains 1kg (500g x 2 Packs) - (Kodra/Varagu/Arikelu/Hark/Varigu) | Native Low GI Mille...,grocery & gourmet foods,https://m.media-amazon.com/images/I/714qJ-AWaOL._AC_UL320_.jpg,260.0
Wheafree Gluten Free Multigrain Flour (5Kg) | Soya Free | Lactose Free | Easy to Digest | Suitable for Celiacs,grocery & gourmet foods,https://m.media-amazon.com/images/I/61BN+k+o9DL._AC_UL320_.jpg,700.0
"Sugar Free Gold Low Calorie Sweetener - Pack of 2 (100 Sachet x 2), Box",grocery & gourmet foods,https://m.media-amazon.com/images/I/71bOaEyVT4L._AC_UL320_.jpg,250.0
Pintola Organic Peanut Butter (Crunchy) (1kg),grocery & gourmet foods,https://m.media-amazon.com/images/I/71gQVK49PCL._AC_UL320_.jpg,525.0
"Fresh Groundnut, 500g",grocery & gourmet foods,https://m.media-amazon.com/images/I/511MZzma-+L._AC_UL320_.jpg,92.0
Himalaya Liv.52 DS Tablets 60,grocery & gourmet foods,https://m.media-amazon.com/images/I/71CBlFFaTgL._AC_UL320_.jpg,170.0
"Sunbean Beaten Caffe, Instant Coffee Paste 250g Jar | Rich, Creamy and Frothy Beaten Coffee | Make Hot Coffee, Cappuccino ...",grocery & gourmet foods,https://m.media-amazon.com/images/I/81-YOYAYEcL._AC_UL320_.jpg,295.0
Organic India - Jaggery Powder 500g (Pack of 2),grocery & gourmet foods,https://m.media-amazon.com/images/I/71+r+AxZwnL._AC_UL320_.jpg,184.0
"Krishna's Diabic Care Juice - 1000 ml | Blend of 11 herbs Methi, Amla, Karela, Jamun, Kutki, Guduchi & 5 other herbs to ma...",grocery & gourmet foods,https://m.media-amazon.com/images/I/81dJMIIXxiL._AC_UL320_.jpg,400.0
"Jaago CTC Leaf Tea, 1 Kg | tea 1kg | Chai Patti | Black CTC Tea | Loose Tea | Black Tea | Tea 1kg Pack",grocery & gourmet foods,https://m.media-amazon.com/images/I/81dCUBXmNaL._AC_UL320_.jpg,215.0
"Amazon Brand - Vedaka Premium Toor/Arhar Dal, 1 kg|Rich in Protein|No Cholesterol|No Additives",grocery & gourmet foods,https://m.media-amazon.com/images/I/71TIju5KrHL._AC_UL320_.jpg,299.0
Cavin's Vanilla Milkshake 200 ml,grocery & gourmet foods,https://m.media-amazon.com/images/I/51c2NwuOrRL._AC_UL320_.jpg,40.0
"Fresh Papaya Small, 1pc",grocery & gourmet foods,https://m.media-amazon.com/images/I/413EIL9mteL._AC_UL320_.jpg,78.0
R R AGRO FOODS Chia Seeds 1 KG - Premium Organic Chia Seed | Healthy Snacks | Chia Seeds for Weight Loss Pack of 1,grocery & gourmet foods,https://m.media-amazon.com/images/I/61a+Ae1u+XL._AC_UL320_.jpg,899.0
"Amazon Brand - Solimo CornFlakes, 1.2Kg",grocery & gourmet foods,https://m.media-amazon.com/images/I/71NiYlTTrRL._AC_UL320_.jpg,425.0
"JIWA healthy by nature Organic khapli wheat flour, 1Kg",grocery & gourmet foods,https://m.media-amazon.com/images/I/91uV9dtNipL._AC_UL320_.jpg,245.0
Yogabar Protein Bars Assorted Pack of 6 | 20g Protein Bar | Energy Bars | Added Probiotics & Whey | 20g Protein & 10g Fibr...,grocery & gourmet foods,https://m.media-amazon.com/images/I/713+Fk6Hy6L._AC_UL320_.jpg,749.0
"Amul Delicious, 500 g",grocery & gourmet foods,https://m.media-amazon.com/images/I/71KXKn2ngpL._AC_UL320_.jpg,106.0
"Del Monte Spaghetti Pasta (Imported), 500 grams, No Artificial Flavours",grocery & gourmet foods,https://m.media-amazon.com/images/I/51tr1+ASQfL._AC_UL320_.jpg,240.0
Kapiva Himalayan Apple Cider Vinegar with Mother Vinegar 500ml,grocery & gourmet foods,https://m.media-amazon.com/images/I/71yQr4esFvL._AC_UL320_.jpg,299.0
Nutrilin Jumbo Handpicked Lotus Seeds / Fox Nuts Big Size Phool Makhana (Pop / Gorgon Nut Puffed Kernels ) (1kg),grocery & gourmet foods,https://m.media-amazon.com/images/I/71FDuM5fzML._AC_UL320_.jpg,999.0
"Manna Millets - Natural Grains Combo Pack of 3 | Foxtail 500g, Kodo 500g, Little 500g | Native Low GI Millet Rice | Nutrie...",grocery & gourmet foods,https://m.media-amazon.com/images/I/81-5WlO6P3L._AC_UL320_.jpg,390.0
Finish Dishwasher Powerball Classic - 110 Tablets,grocery & gourmet foods,https://m.media-amazon.com/images/I/71aw0fRofLL._AC_UL320_.jpg,3999.0
"Slurrp Farm Healthy Pancake Lovers Combo | Blueberry, Classic, Chocolate & Banana | No Maida, Wheat & Preservative | Made ...",grocery & gourmet foods,https://m.media-amazon.com/images/I/71gc8lIXYKL._AC_UL320_.jpg,646.0
Lotus Biscoff Cookies - Caramelized Biscuit Cookie - 250 Gram - Non-GMO Project Verified and Vegan,grocery & gourmet foods,https://m.media-amazon.com/images/I/51V9nnTD2OL._AC_UL320_.jpg,299.0
"MuscleBlaze High Protein Natural Peanut Butter with Whey Protein Concentrate, Crunchy, 37 g Protein, Unsweetened, No Added...",grocery & gourmet foods,https://m.media-amazon.com/images/I/61SGiOWN7oL._AC_UL320_.jpg,599.0
"Zero Sugar (400g) | Stevia and Monk Fruit Sweetener | No Maltodextrin, No Aspartame | No Bitter Aftertaste | Sugar Free | ...",grocery & gourmet foods,https://m.media-amazon.com/images/I/71QEW2GX8pL._AC_UL320_.jpg,799.0
"Haldiram's Nagpur Ratlami Sev, 200g",grocery & gourmet foods,https://m.media-amazon.com/images/I/91T4lTKSivL._AC_UL320_.jpg,47.0
"Nature Fresh Sampoorna Atta, superior MP Atta , 10kg",grocery & gourmet foods,https://m.media-amazon.com/images/I/71Ke1T0gzlL._AC_UL320_.jpg,475.0
"Mo's Raspberry Jam Cookies, 300G | Clean Snack with Richness of Raspberry | Vegan | 100% Natural & Preservatives Free",grocery & gourmet foods,https://m.media-amazon.com/images/I/512FzFDFnXL._AC_UL320_.jpg,395.0
"Kellogg's Crunchy Granola Chocolate & Almonds 450g | 15% Almonds, Baked Multigrain | Golden Wheat, Nutritious Oats, Crispy...",grocery & gourmet foods,https://m.media-amazon.com/images/I/51ClTfjNLSL._AC_UL320_.jpg,350.0
"Britannia Vita Marie Gold Biscuits, 978g",grocery & gourmet foods,https://m.media-amazon.com/images/I/71jKWxXJN+L._AC_UL320_.jpg,155.0
"India Gate Jeera Rice, 1kg",grocery & gourmet foods,https://m.media-amazon.com/images/I/81Gl+eJBmvL._AC_UL320_.jpg,135.0
"VAHDAM Organic Green Tea Bags - 15 Units | Green Tea for Weight Loss | USDA Certified | Zero Calories, Improves Metabolism...",grocery & gourmet foods,https://m.media-amazon.com/images/I/71if4qDP88L._AC_UL320_.jpg,225.0
"Freedom Refined Sunflower Oil, 1L",grocery & gourmet foods,https://m.media-amazon.com/images/I/61urWAN7qAL._AC_UL320_.jpg,195.0
HATHMIC Raw Extra Virgin Coconut Oil (Cold Pressed)1000ml,grocery & gourmet foods,https://m.media-amazon.com/images/I/81vf8mNL+-L._AC_UL320_.jpg,690.0
24 Mantra Organic Sugar/Chini/Chekkara- 1 Kg | Pack of 1 | 100% Organic | Chemical Free & Pesticides Free | Solvent-Free |...,grocery & gourmet foods,https://m.media-amazon.com/images/I/71Diy1BLfjL._AC_UL320_.jpg,145.0
"Cadbury Dairy Milk Chocolate Home Treats Pack, 126g",grocery & gourmet foods,https://m.media-amazon.com/images/I/61FcLovf3mL._AC_UL320_.jpg,149.0
"Haldiram's Nagpur Bhujia Sev, 200g",grocery & gourmet foods,https://m.media-amazon.com/images/I/9166IHTX1WL._AC_UL320_.jpg,55.0
Slurrp Farm Instant Moong Dal Khichdi for Little Ones | No Sugar | No Salt | No Milk | Healthy Cereals for Kids with Real ...,grocery & gourmet foods,https://m.media-amazon.com/images/I/61wg6ugD01L._AC_UL320_.jpg,299.0
"Britannia Toastea Premium Bake Rusk, 150g or 167g (Weight May Vary)",grocery & gourmet foods,https://m.media-amazon.com/images/I/71Df0enz+lL._AC_UL320_.jpg,40.0
"3S Pulses - White Peas, 500g",grocery & gourmet foods,https://m.media-amazon.com/images/I/81ZLncheHoL._AC_UL320_.jpg,249.0
"Haldiram's Nagpur All in One, 200g",grocery & gourmet foods,https://m.media-amazon.com/images/I/71k2IHYdsSL._AC_UL320_.jpg,50.0
Goodricke Roasted Organic Darjeeling Tea - 250gm | 100% Organic Whole Leaf Tea | Darjeeling Long Leaf Tea | Flavoury Golde...,grocery & gourmet foods,https://m.media-amazon.com/images/W/IMAGERENDERING_521856-T1/images/I/61pf3Gwtx8L._AC_UL320_.jpg,300.0
"Weikfield Baking Powder, 100g",grocery & gourmet foods,https://m.media-amazon.com/images/W/IMAGERENDERING_521856-T1/images/I/61GWaDYXo5L._AC_UL320_.jpg,35.0
"Mother Dairy UHT Milk, 1 Ltr",grocery & gourmet foods,https://m.media-amazon.com/images/W/IMAGERENDERING_521856-T1/images/I/613ysfnrr0L._AC_UL320_.jpg,75.0
"Early Foods Dry Fruits Powder - 7 Superfoods Blend, 100 g",grocery & gourmet foods,https://m.media-amazon.com/images/W/IMAGERENDERING_521856-T1/images/I/61Zg9Z1I1cL._AC_UL320_.jpg,300.0
"Kwality Wall's Party Pack, Chocolate, 700ml",grocery & gourmet foods,https://m.media-amazon.com/images/W/IMAGERENDERING_521856-T1/images/I/61P---e10bL._AC_UL320_.jpg,150.0
Top Ramen Masala 480g / 560g (Weight May Vary),grocery & gourmet foods,https://m.media-amazon.com/images/W/IMAGERENDERING_521856-T1/images/I/61+K+fuL+bL._AC_UL320_.jpg,106.0
GO DESi - Pops Trial Pack | Gift Basket | DESi POPz | Tangy Imli | Kaccha Aam | Real Aam | Lollipop,grocery & gourmet foods,https://m.media-amazon.com/images/W/IMAGERENDERING_521856-T1/images/I/81CKlcZtZpL._AC_UL320_.jpg,500.0
"Nestle a+ Nourish Toned Milk, 1Ltr",grocery & gourmet foods,https://m.media-amazon.com/images/W/IMAGERENDERING_521856-T1/images/I/71ev0ma8sML._AC_UL320_.jpg,101.0
"Wagh Bakri Ginger Instant Tea Premix, 140g",grocery & gourmet foods,https://m.media-amazon.com/images/W/IMAGERENDERING_521856-T1/images/I/51fB99AlfZL._AC_UL320_.jpg,150.0
"KLF Coconad Instant Coconut Milk Powder, 1kg",grocery & gourmet foods,https://m.media-amazon.com/images/W/IMAGERENDERING_521856-T1/images/I/61c6GnyKXiL._AC_UL320_.jpg,850.0
"Kellogg's Corn Flakes Original 275g | Power of 5: Energy, Protein, Iron, Calcium, Vitamins B1, B2, B3 & C | Cornflakes, Br...",grocery & gourmet foods,https://m.media-amazon.com/images/W/IMAGERENDERING_521856-T1/images/I/71MDLrgAmrL._AC_UL320_.jpg,99.0
"More Superior Clove (Lavang), 20g Pouch",grocery & gourmet foods,https://m.media-amazon.com/images/W/IMAGERENDERING_521856-T1/images/I/81bPCm8T-EL._AC_UL320_.jpg,249.0
MTR Upma Mix 160g,grocery & gourmet foods,https://m.media-amazon.com/images/W/IMAGERENDERING_521856-T1/images/I/61uMpmOG7HL._AC_UL320_.jpg,50.0
Paper Boat Dry Fruit Chikki | No Preservatives and Colors | 250g / 280g (Weight May Vary),grocery & gourmet foods,https://m.media-amazon.com/images/W/IMAGERENDERING_521856-T1/images/I/61JCP5bfyWL._AC_UL320_.jpg,300.0
"Parle Rol-a-Cola, 100g",grocery & gourmet foods,https://m.media-amazon.com/images/W/IMAGERENDERING_521856-T1/images/I/71rIvHnAWHL._AC_UL320_.jpg,20.0
"UNIBIC Fruit and Nut Cookies, 75g",grocery & gourmet foods,https://m.media-amazon.com/images/W/IMAGERENDERING_521856-T1/images/I/51qJDXkBDEL._AC_UL320_.jpg,30.0
"Thums Up Soft Drink PET Bottle, 1.25 L",grocery & gourmet foods,https://m.media-amazon.com/images/W/IMAGERENDERING_521856-T1/images/I/61thtH3amWL._AC_UL320_.jpg,65.0
"Fortune Xpert Pro Sugar Conscious Edible Oil, Pouch, 1 L",grocery & gourmet foods,https://m.media-amazon.com/images/W/IMAGERENDERING_521856-T1/images/I/41-qtTLvfSL._AC_UL320_.jpg,199.0
"Colgate Kids Strawberry 40g Toothpaste, Cavity Protection",grocery & gourmet foods,https://m.media-amazon.com/images/W/IMAGERENDERING_521856-T1/images/I/613ihx25FJL._AC_UL320_.jpg,62.0
"JIWA healthy by nature Gluten Free Atta/Flour, 1Kg",grocery & gourmet foods,https://m.media-amazon.com/images/W/IMAGERENDERING_521856-T1/images/I/91OKqyGsEFL._AC_UL320_.jpg,199.0
"Amazon Brand - Solimo Durum Wheat Spaghetti Pasta, 500g pack of 2",grocery & gourmet foods,https://m.media-amazon.com/images/W/IMAGERENDERING_521856-T1/images/I/61to94oZGFL._AC_UL320_.jpg,396.0
"Parle Melody Chocolate, 195g",grocery & gourmet foods,https://m.media-amazon.com/images/W/IMAGERENDERING_521856-T1/images/I/819KQPlk3xL._AC_UL320_.jpg,50.0
Keya Arabian Sea Salt 1kg…,grocery & gourmet foods,https://m.media-amazon.com/images/W/IMAGERENDERING_521856-T1/images/I/51wkF2o51zL._AC_UL320_.jpg,290.0
"Cadbury Fuse Chocolate Home Treats Bite, 108.5 g",grocery & gourmet foods,https://m.media-amazon.com/images/W/IMAGERENDERING_521856-T1/images/I/71yRZNkQFuL._AC_UL320_.jpg,120.0
More Brown Rice Loose 1 Kg,grocery & gourmet foods,https://m.media-amazon.com/images/W/IMAGERENDERING_521856-T1/images/I/71QA5hOhJ+L._AC_UL320_.jpg,200.0
"Amazon Brand - Solimo Premium Cashews, 250 g",grocery & gourmet foods,https://m.media-amazon.com/images/W/IMAGERENDERING_521856-T1/images/I/51bUyHuq6hL._AC_UL320_.jpg,435.0
PILGRIM Korean 5% Vitamin C Face Serum (Oil Based) for glowing skin with Hyaluronic acid | Vitamin c serum for radiant ski...,grocery & gourmet foods,https://m.media-amazon.com/images/W/IMAGERENDERING_521856-T1/images/I/51Q0+yjd9hL._AC_UL320_.jpg,550.0
"Keya Italian Pizza Oregano 80gm, Pack 2",grocery & gourmet foods,https://m.media-amazon.com/images/W/IMAGERENDERING_521856-T1/images/I/61M+NtDUHzL._AC_UL320_.jpg,218.0
"Nutty Gritties Premium Mix Berries Dried Fruits Berry 200g - Dried Cranberries, Blueberries, Strawberries, Black Currants...",grocery & gourmet foods,https://m.media-amazon.com/images/W/IMAGERENDERING_521856-T1/images/I/71Yxp0Mn-xL._AC_UL320_.jpg,390.0
Anveshan Wood Pressed Coconut Oil - 1 Litre | Plastic Bottle | Kolhu/Kacchi Ghani/Chekku | Natural | Chemical-Free | Cold ...,grocery & gourmet foods,https://m.media-amazon.com/images/W/IMAGERENDERING_521856-T1/images/I/61j3xzn3wNL._AC_UL320_.jpg,679.0
"Unibic Snack bar  Fruit & Nut 360g Pack of 12, 360g",grocery & gourmet foods,https://m.media-amazon.com/images/W/IMAGERENDERING_521856-T1/images/I/61O71FR2GzL._AC_UL320_.jpg,480.0
