name,main_category,image,actual_price
SAHU GAJAK BHANDAR Chikki 600 gm Mungfali Gazak | Chikkis Jaggery | Crunchy Peanut Bar | Groundnut Mittai | Traditional In...,grocery & gourmet foods,https://m.media-amazon.com/images/W/IMAGERENDERING_521856-T1/images/I/81JSAAyq+8L._AC_UL320_.jpg,600.0
Veganic Fryums Papad Ready To Fry Snack - 400GM | Only Seller Of Imported Fryums | Multicolour (20 in 1) Mix Imported Fryu...,grocery & gourmet foods,https://m.media-amazon.com/images/W/IMAGERENDERING_521856-T1/images/I/81b9C+O2P2L._AC_UL320_.jpg,299.0
"Royal Foodery Amber dates imported from madina Ajwa Al-Saudi - Finest Ajwa Dates (Khajoor/Khajur) of Madina, 1Kg",grocery & gourmet foods,https://m.media-amazon.com/images/W/IMAGERENDERING_521856-T1/images/I/61udJ+EWPoL._AC_UL320_.jpg,1999.0
Organic Nature Premium Roasted Green Peas Masala MATAR Spicy & Crunchy (Pack of 400 Gram),grocery & gourmet foods,https://m.media-amazon.com/images/W/IMAGERENDERING_521856-T1/images/I/71MZYenOvML._AC_UL320_.jpg,399.0
Organic Box Pistachios Nut (Salted Pista) Roasted 100% Pure Natural Irani Pista (500 Gram),grocery & gourmet foods,https://m.media-amazon.com/images/W/IMAGERENDERING_521856-T1/images/I/71X1C58WFTL._AC_UL320_.jpg,999.0
Wonderland Foods - Dry Fruits California Walnut Kernels (Akhrot Giri) I 200g Jar,grocery & gourmet foods,https://m.media-amazon.com/images/W/IMAGERENDERING_521856-T1/images/I/71WLkNSIqHL._AC_UL320_.jpg,399.0
Siera Healthy Mix Nuts Powder |Dry Fruits Powder for Baby| Nut Powder for Babies | Baby Food | - 75g,grocery & gourmet foods,https://m.media-amazon.com/images/W/IMAGERENDERING_521856-T1/images/I/61jGpZp48TL._AC_UL320_.jpg,799.0
"Mukharochak Special Papri Chanachur, 400g",grocery & gourmet foods,https://m.media-amazon.com/images/W/IMAGERENDERING_521856-T1/images/I/61JaLR-2-iL._AC_UL320_.jpg,138.0
"Hup Seng Classic Cream Crackers/Biskut Cap Ping Pong, 400g",grocery & gourmet foods,https://m.media-amazon.com/images/W/IMAGERENDERING_521856-T1/images/I/81EaLrPJKkL._AC_UL320_.jpg,599.0
"Mouthmelt Methi Masala Soft Thepla (Ready to Eat,Rosted, Not Fried) (with Garlic & Jinger) 800 Grams (200G x 4 Packets)",grocery & gourmet foods,https://m.media-amazon.com/images/W/IMAGERENDERING_521856-T1/images/I/513FoYdvsWL._AC_UL320_.jpg,400.0
Malkist Cappuccino Flavoured Cracker Biscuits - 144g (Jumbo Pack)- Pack of 4,grocery & gourmet foods,https://m.media-amazon.com/images/W/IMAGERENDERING_521856-T1/images/I/71K9w+CHV8L._AC_UL320_.jpg,240.0
"Nourish Organics Ginger Oats Cookies, 140g",grocery & gourmet foods,https://m.media-amazon.com/images/W/IMAGERENDERING_521856-T1/images/I/81v9WQY6crL._AC_UL320_.jpg,225.0
Miltop Flax Alsi Roasted Seed 1 KG,grocery & gourmet foods,https://m.media-amazon.com/images/W/IMAGERENDERING_521856-T1/images/I/71fogRYqPeL._AC_UL320_.jpg,500.0
Wingreens Farms Naan Chips - Butter Garlic 150g,grocery & gourmet foods,https://m.media-amazon.com/images/W/IMAGERENDERING_521856-T1/images/I/71va+esTz-L._AC_UL320_.jpg,95.0
"VIStevia Sugar Free Amla Candy - Diabetic Friendly, Stevia Sweetened (200gm)",grocery & gourmet foods,https://m.media-amazon.com/images/I/51Npq+sD8SL._AC_UL320_.jpg,370.0
"Happilo Premium Sunflower Seeds (No Shells), 250g (Pack of 2)",grocery & gourmet foods,https://m.media-amazon.com/images/I/71P7Z7jnalL._AC_UL320_.jpg,310.0
"Daadi's Khakhra, Chilli Kothmir, 50g",grocery & gourmet foods,https://m.media-amazon.com/images/I/81t5JRWwnjL._AC_UL320_.jpg,30.0
Sitashree Laxminarayan Chiwda - Pack of 2 ( 1 Poha Chiwda 500g + 1 Badam Chiwda 500g ),grocery & gourmet foods,https://m.media-amazon.com/images/I/91J5yDIzrPL._AC_UL320_.jpg,456.0
Sitara Foods Bitter Gourd Chips Karela Chips Diabetic Snack Crispy 250 Gram Pack,grocery & gourmet foods,https://m.media-amazon.com/images/I/619sl+BDywL._AC_UL320_.jpg,317.0
Jabsons Roasted Chana Hing Jeera 150g (Pack of 6),grocery & gourmet foods,https://m.media-amazon.com/images/I/71Xyco6mZ5L._AC_UL320_.jpg,420.0
Dizzle Chikni Fiki Supari (Non Sweet with Peppermint)100g,grocery & gourmet foods,https://m.media-amazon.com/images/I/51CKgYY-4AL._AC_UL320_.jpg,385.0
Haldiram's Nagpur Salted Peanuts (Pack of 4 X 200 g),grocery & gourmet foods,https://m.media-amazon.com/images/I/71eaYH+rtCL._AC_UL320_.jpg,200.0
Organic Box Anardana Drops Pachak Delicious Anardana Goli (500 Grams) churan diegestive mouthfreshner mukhwas,grocery & gourmet foods,https://m.media-amazon.com/images/I/81uUxunNy6L._AC_UL320_.jpg,499.0
"Berries And Nuts Premium Jumbo Dried Apricot | Khurbani, Jardalu, Khumani, Khubani Dry Fruit | 800 Grams",grocery & gourmet foods,https://m.media-amazon.com/images/I/71tSHdZPNBL._AC_UL320_.jpg,750.0
WONDERLAND FOODS (DEVICE) Dry Fruits Combo Pack of Almond (200 g) and Walnut Kernels (200 g),grocery & gourmet foods,https://m.media-amazon.com/images/I/61BrJCI5HuL._AC_UL320_.jpg,735.0
"Fruitri Premium Queen Kalmi Dates 1kg, Juicy & Delicious Khajoor, Arab Khajur, 100% Naturally Dried & free from any Preser...",grocery & gourmet foods,https://m.media-amazon.com/images/I/81-BKhrLBRL._AC_UL320_.jpg,1399.0
FARMORY Golden Fingers Fryums Ready-to-Fry Papad Snacks 400GM,grocery & gourmet foods,https://m.media-amazon.com/images/I/716ofLvawlL._AC_UL320_.jpg,250.0
Foodaids Healthy Millet Bhujia Namkeen (Spicy Mint Pudina Flavour) 200gm Mixture of 5 millets Bajra / Jowar / Ragi / Kangn...,grocery & gourmet foods,https://m.media-amazon.com/images/I/41JgtOH47ZL._AC_UL320_.jpg,199.0
"Dry Fruit Hub Premium Medjoul Dates 1kg,Khajur/Khejur Medjool Dates,Medjoul Khajoor Pack 1kg",grocery & gourmet foods,https://m.media-amazon.com/images/I/71jye0b-iNL._AC_UL320_.jpg,1800.0
Touchstone Premium Jumbo Whole Cashew Nuts W190 -1kg (1000 Grams),grocery & gourmet foods,https://m.media-amazon.com/images/I/81GEnEgMh6L._AC_UL320_.jpg,1800.0
Gluten-Free Ragi Oats Cookies | Refined Sugar-Free | Eggless | No Maida | No Preservatives | Fibre Rich | (180),grocery & gourmet foods,https://m.media-amazon.com/images/I/61b-22J33LL._AC_UL320_.jpg,220.0
"Pepperidge Farm Goldfish Baked Snack Crackers Cheddar Colors | Sourced from Plants, 6.6 oz / 187 g",grocery & gourmet foods,https://m.media-amazon.com/images/I/81q5UkMjVxL._AC_UL320_.jpg,1299.0
LuvIt Chocwich & Chocwich White Home Delights Wafer Chocolates | Crunchy & Delicious | Homepack | Gift Combo | Pack of 4-1...,grocery & gourmet foods,https://m.media-amazon.com/images/I/61gXIzPPJWS._AC_UL320_.jpg,560.0
Nutribee 100% Whole Wheat Atta Rusk | Refined Sugar-Free | Healthy Diet Toast | No Maida and Sugar | No Preservatives | 840g,grocery & gourmet foods,https://m.media-amazon.com/images/I/91mYeDwiOES._AC_UL320_.jpg,520.0
CORNITOS PARTY MIX-450gram,grocery & gourmet foods,https://m.media-amazon.com/images/I/61cOIbyqkQL._AC_UL320_.jpg,300.0
VedoMax Kapoor Kachri | Kapur Kachri | - (100 gm),grocery & gourmet foods,https://m.media-amazon.com/images/I/61HFhpNEh9L._AC_UL320_.jpg,1999.0
"Lemor Special Nadiyadi Bhusa (400 GMS, 2 Packets of 200 GMS) | Namkeen Mixture for Foodie Indians",grocery & gourmet foods,https://m.media-amazon.com/images/I/81rNbhg+svL._AC_UL320_.jpg,360.0
"Haldiram's Nagpur Rasgulla, 1kg",grocery & gourmet foods,https://m.media-amazon.com/images/I/81EpT9kb+wL._AC_UL320_.jpg,225.0
"Ammi samayal Sun Dried Turkey Berry, 350 Grams sundakkai Vathal / vadagam",grocery & gourmet foods,https://m.media-amazon.com/images/W/IMAGERENDERING_521856-T2/images/I/91Usc+nbP7L._AC_UL320_.jpg,399.0
"BASKETVILLE 100% Natural & Roasted & Lightly Salted Irani Pistachios - Pack of 2, 800 Gm",grocery & gourmet foods,https://m.media-amazon.com/images/W/IMAGERENDERING_521856-T2/images/I/6156DiGbkRL._AC_UL320_.jpg,1986.0
True Elements Berries Mix 250g - Dried Berries | Mix of Cranberries & Blueberries | Berry Mix | Healthy Snack,grocery & gourmet foods,https://m.media-amazon.com/images/W/IMAGERENDERING_521856-T2/images/I/51WOgg0QbNL._AC_UL320_.jpg,595.0
Vellanki Foods Andhra Sweets Boorelu(500gms),grocery & gourmet foods,https://m.media-amazon.com/images/W/IMAGERENDERING_521856-T2/images/I/61IRhdLBXJL._AC_UL320_.jpg,374.0
Roods Fresh Original Kimia Gold Dates pack of 1 BOX,grocery & gourmet foods,https://m.media-amazon.com/images/W/IMAGERENDERING_521856-T2/images/I/71YV5CjqbkL._AC_UL320_.jpg,500.0
"Early Foods - Pack of 2 Pregnancy Cookies , Millet Biscuits | Jaggery Biscuits (Ragi Biscuits with Sesame & Bajra Barnyard...",grocery & gourmet foods,https://m.media-amazon.com/images/W/IMAGERENDERING_521856-T2/images/I/71h7eSCYf1L._AC_UL320_.jpg,398.0
"Fazlani Foods Exotic Classic and Black Olives Hummus Dip, Made of Chick Peas & Tahini - Pack of 2 (100 Grams Each)",grocery & gourmet foods,https://m.media-amazon.com/images/W/IMAGERENDERING_521856-T2/images/I/71epC9+U5ML._AC_UL320_.jpg,198.0
"Haldiram's Nagpur Moong Dal, 400 g (200 g x Pack of 2)",grocery & gourmet foods,https://m.media-amazon.com/images/W/IMAGERENDERING_521856-T2/images/I/71mkNgKKTgL._AC_UL320_.jpg,110.0
Wonderland Foods (Device) Almond 500g & Walnut kernel 350g Dry Fruits Combo - 850g (Jar),grocery & gourmet foods,https://m.media-amazon.com/images/W/IMAGERENDERING_521856-T2/images/I/715fQLNmyBL._AC_UL320_.jpg,1750.0
"EXOTES, Green Raisins Vacuum Packed Popular Pouch g, 250 gram",grocery & gourmet foods,https://m.media-amazon.com/images/W/IMAGERENDERING_521856-T2/images/I/91alQV9wcNL._AC_UL320_.jpg,88.0
PRIME CULTIVATOR: Dry Sweet Amla Candy (Indian Gooseberry) (400g),grocery & gourmet foods,https://m.media-amazon.com/images/W/IMAGERENDERING_521856-T2/images/I/71mCG4YD5aL._AC_UL320_.jpg,290.0
"Natural 1 KG Walnuts 1kg Without Shell Akhoth Giri Quarter Kernels (Raw,500g x 2) VACUUM PACK",grocery & gourmet foods,https://m.media-amazon.com/images/W/IMAGERENDERING_521856-T2/images/I/51pFhMdQ9cS._AC_UL320_.jpg,3000.0
"Wingreens Monsoon Harvest Mixed Berries | Antioxidant rich, immunity boosting | high fiber | 100% natural | 200g",grocery & gourmet foods,https://m.media-amazon.com/images/W/IMAGERENDERING_521856-T2/images/I/51fZnSWACML._AC_UL320_.jpg,390.0
Nature Purify Flavoured Mukhwas ( Mouth Freshener ) - 400G (Rajasthani Mukhwas),grocery & gourmet foods,https://m.media-amazon.com/images/W/IMAGERENDERING_521856-T2/images/I/510vaahzbnL._AC_UL320_.jpg,399.0
"Parle Premium Plain Rusk - Real Elaichi, 1 kg Pack",grocery & gourmet foods,https://m.media-amazon.com/images/W/IMAGERENDERING_521856-T2/images/I/71Wg4QH+TFL._AC_UL320_.jpg,175.0
"Jyoti Ben's Mukhwaas - Roasted Saunf with Dhaniya Daal, Ajwain, Till & Suwa",grocery & gourmet foods,https://m.media-amazon.com/images/W/IMAGERENDERING_521856-T2/images/I/81s3w5kp15L._AC_UL320_.jpg,350.0
TRYSOME SORGUM MILLET (JAWAR CHIWDA) WITH BEETROOT MIX.,grocery & gourmet foods,https://m.media-amazon.com/images/W/IMAGERENDERING_521856-T2/images/I/61Vda7gS1pL._AC_UL320_.jpg,
Freshtige Jumbo Handpicked Lotus Seeds Combo Of 2 (1kg pack of 2(500grams*2)) Big Size Phool Makhana (Pop / Gorgon Nut Fre...,grocery & gourmet foods,https://m.media-amazon.com/images/W/IMAGERENDERING_521856-T2/images/I/51Wos9CSGXL._AC_UL320_.jpg,999.0
"Trysome Roasted Multi Millets Murmura Mix, Gluten free Millets Murmura (Mixture of Murmura made up of Pearl Millet, Sorgum...",grocery & gourmet foods,https://m.media-amazon.com/images/W/IMAGERENDERING_521856-T2/images/I/71pK0lRtDXL._AC_UL320_.jpg,
Open Secret Peanut Butter Story Box |2 Healthy Peanut Butter Story Box|Peanuts & Chocolate- All at Once|Family Snacks Bisc...,grocery & gourmet foods,https://m.media-amazon.com/images/W/IMAGERENDERING_521856-T2/images/I/61xtaAPPPhL._AC_UL320_.jpg,210.0
"Bob's Red Mill Gluten Free Nutritional Yeast,142gm",grocery & gourmet foods,https://m.media-amazon.com/images/W/IMAGERENDERING_521856-T2/images/I/612F0Ne9RkL._AC_UL320_.jpg,820.0
"Cadbury Oreo Original Vanilla Creme Biscuit, 46.3g",grocery & gourmet foods,https://m.media-amazon.com/images/W/IMAGERENDERING_521856-T2/images/I/61nxEZi9XuL._AC_UL320_.jpg,10.0
"Kikibix Salty Ajwain Multigrain Biscuit | for Diabetics | High Fibre Digestive Cookies | No Maida, No Refine Sugar | Sweet...",grocery & gourmet foods,https://m.media-amazon.com/images/W/IMAGERENDERING_521856-T2/images/I/81hfXfMeMGL._AC_UL320_.jpg,459.0
TRYSOME MAKHANA CHIWDA VEGETABLE MIX.,grocery & gourmet foods,https://m.media-amazon.com/images/W/IMAGERENDERING_521856-T2/images/I/713cvz6FhNL._AC_UL320_.jpg,
Namo Organics - Dried Cranberries & Blueberries - 250 Gm Each (500 Gm) - Cranberry Blueberry Berry Mix | Blueberry Cranber...,grocery & gourmet foods,https://m.media-amazon.com/images/W/IMAGERENDERING_521856-T1/images/I/61oZNO6yZPL._AC_UL320_.jpg,999.0
"Happy Bar - Nutritious Variety Box, 30g X 12 Bars",grocery & gourmet foods,https://m.media-amazon.com/images/W/IMAGERENDERING_521856-T1/images/I/51XeAAUA0gL._AC_UL320_.jpg,480.0
"Fruitri Pista Kernals Without Shell, Sada Pista (500)",grocery & gourmet foods,https://m.media-amazon.com/images/W/IMAGERENDERING_521856-T1/images/I/41MmMb3cRWL._AC_UL320_.jpg,1999.0
Radha Govind Organic Black Dry Dates | Sukha Khajoor | Kala Chuara | Kharik 1Kg,grocery & gourmet foods,https://m.media-amazon.com/images/W/IMAGERENDERING_521856-T1/images/I/71mulMTlIbL._AC_UL320_.jpg,999.0
777 Appalam No.1 (Dia)- 300g (Pack of 3),grocery & gourmet foods,https://m.media-amazon.com/images/W/IMAGERENDERING_521856-T1/images/I/514EY-SyL8L._AC_UL320_.jpg,396.0
"LittleVeda Pregnancy Cookies healthy snack Trimester1&2(0-6months) (Pack of 2)(150g+150g) Rich in Iron,Calcium,Folic Acid-...",grocery & gourmet foods,https://m.media-amazon.com/images/W/IMAGERENDERING_521856-T1/images/I/71e-Yo45pwL._AC_UL320_.jpg,598.0
"Nutty Gritties Premium California Roasted Almonds 200g, Lightly Salted, Dry Roasted, Non Fried, Zero Oil, Crunchy Healthy ...",grocery & gourmet foods,https://m.media-amazon.com/images/W/IMAGERENDERING_521856-T1/images/I/71fBHFuNTIL._AC_UL320_.jpg,395.0
"Urban Platter Whole Ground Flax Seed Flour, 400g",grocery & gourmet foods,https://m.media-amazon.com/images/W/IMAGERENDERING_521856-T1/images/I/71KmBm09YfL._AC_UL320_.jpg,250.0
"Blueorganika Irani Mamra Almonds | Premium Mamra badam Giri | Natural Sweet, Rich in Protein, Hygienically Packed (500gm)",grocery & gourmet foods,https://m.media-amazon.com/images/W/IMAGERENDERING_521856-T1/images/I/81U-SqanXkL._AC_UL320_.jpg,2200.0
looms & weaves - Ready to eat Kerala Snacks Kokkuvada/ Ribbon Pakoda - 250 gm,grocery & gourmet foods,https://m.media-amazon.com/images/W/IMAGERENDERING_521856-T1/images/I/81UFN6S6zGL._AC_UL320_.jpg,299.0
"Chheda's - Bhavnagri Gathiya - Fried Gram Flour Sticks, Carom Seeds - 350 Gm Pack of 1",grocery & gourmet foods,https://m.media-amazon.com/images/W/IMAGERENDERING_521856-T1/images/I/713TjezkN6L._AC_UL320_.jpg,215.0
"4700BC Gourmet Popcorn, Premium Gift Set, 440g, (4 Tins: 1 Hawaiian Barbeque Cheese, 1 Himalayan Salt Caramel, 1 Nutty Tux...",grocery & gourmet foods,https://m.media-amazon.com/images/W/IMAGERENDERING_521856-T1/images/I/71nm0caEBRL._AC_UL320_.jpg,999.0
Medhyata Californian Roasted & Salted Pistachios - Pista Dry Fruits Namkeen Pistha California With Shell (500g),grocery & gourmet foods,https://m.media-amazon.com/images/W/IMAGERENDERING_521856-T1/images/I/81ztWxDarqL._AC_UL320_.jpg,649.0
Leeve Brad Dry Fruit Nuts Godambee Marking Nut Bhilawa Seed Anacardium Goddambi Seeds 200 g,grocery & gourmet foods,https://m.media-amazon.com/images/W/IMAGERENDERING_521856-T1/images/I/514MORHnDtL._AC_UL320_.jpg,450.0
"More Combo - Parle Monaco Salted Biscuits Classic Regular, 200g (Pack of 3) Promo Pack",grocery & gourmet foods,https://m.media-amazon.com/images/W/IMAGERENDERING_521856-T1/images/I/816paGHaczL._AC_UL320_.jpg,120.0
Roods Fresh Original Kimia Gold Dates ( Pack Of 2 BOX ),grocery & gourmet foods,https://m.media-amazon.com/images/W/IMAGERENDERING_521856-T1/images/I/71SktQ5Gq9L._AC_UL320_.jpg,600.0
Dry Paan | Sukha Meetha Pan | Pan (Without Supari & Areca Nut) | Mouth Freshener After Meal snack (Mukhwas) | Sweet Pan (4...,grocery & gourmet foods,https://m.media-amazon.com/images/W/IMAGERENDERING_521856-T1/images/I/51zk4oSaKiL._AC_UL320_.jpg,549.0
"Dry Fruit Hub Pecan Nuts 250gms, Pecans, Pecan Nuts Organic, Jumbo Pecan Nuts, Organic Pecan Nuts",grocery & gourmet foods,https://m.media-amazon.com/images/W/IMAGERENDERING_521856-T1/images/I/81RqKnR3M2L._AC_UL320_.jpg,950.0
Masala Bhelpuri Bambaiya (325 g),grocery & gourmet foods,https://m.media-amazon.com/images/W/IMAGERENDERING_521856-T1/images/I/517IU2Y9zgL._AC_UL320_.jpg,
Vezlay SOYA Chikka 100 gm (Pack of 2),grocery & gourmet foods,https://m.media-amazon.com/images/W/IMAGERENDERING_521856-T1/images/I/51i5BxIzSCL._AC_UL320_.jpg,220.0
Lo! Low Carb Delights - Coconut Flour Keto 500g | Gluten Free Flour | High Fiber Ultra Low Carb Coconut Flour Powder | All...,grocery & gourmet foods,https://m.media-amazon.com/images/W/IMAGERENDERING_521856-T1/images/I/616DgOuUHOL._AC_UL320_.jpg,349.0
"Rostaa Medjool Premium Dry Dates Healthy & Nutrious Snack (Gluten Free, Non-GMO & Vegan) 680 gms",grocery & gourmet foods,https://m.media-amazon.com/images/W/IMAGERENDERING_521856-T1/images/I/91+EdYilTrL._AC_UL320_.jpg,1680.0
Tulsi California Almonds Roasted Nuts Lightly Salted 400g (200g x 2),grocery & gourmet foods,https://m.media-amazon.com/images/W/IMAGERENDERING_521856-T1/images/I/81Iv+u3KASL._AC_UL320_.jpg,799.0
"Marwar Chana Masala Papad,(Handmade, Medium Spicy, Rajasthani Flavor) 400g Zipper Pack of 1",grocery & gourmet foods,https://m.media-amazon.com/images/W/IMAGERENDERING_521856-T1/images/I/716VDB8eHHL._AC_UL320_.jpg,300.0
Dilbahar's Yummy Digestive Jeera Goli 220g & Anardana Goli 210g Combo Pack of 2),grocery & gourmet foods,https://m.media-amazon.com/images/W/IMAGERENDERING_521856-T1/images/I/51s69bYhS5L._AC_UL320_.jpg,245.0
Prolicious 2X Protein Methi Flavour Khakra | NO Palm Oil | Crispy | Ready to Eat | Flavourful | High Protein Healthy Eveni...,grocery & gourmet foods,https://m.media-amazon.com/images/W/IMAGERENDERING_521856-T1/images/I/519Wfzy1UFL._AC_UL320_.jpg,480.0
"Sunfeast Bounce Cream Tangy Orange, 82g Pack of 20",grocery & gourmet foods,https://m.media-amazon.com/images/W/IMAGERENDERING_521856-T1/images/I/91pNXwojrAL._AC_UL320_.jpg,200.0
"Fruitri Sweet and Crispy California Almonds, Badam Giri, 1kg",grocery & gourmet foods,https://m.media-amazon.com/images/W/IMAGERENDERING_521856-T1/images/I/41sfJLEqW-L._AC_UL320_.jpg,1599.0
"Nourish Organics Oats Cranberry Cookies, 130g",grocery & gourmet foods,https://m.media-amazon.com/images/W/IMAGERENDERING_521856-T1/images/I/816cd6EVZNL._AC_UL320_.jpg,
SAHU GAJAK BHANDAR Crispy Gajjak 400g | Chikki | Gazak | Gachak | Gazzak | Tilkut | Sesame Bar | Jaggery Sweets & Snacks |...,grocery & gourmet foods,https://m.media-amazon.com/images/W/IMAGERENDERING_521856-T1/images/I/81rn77iZUOL._AC_UL320_.jpg,400.0
Yogabar Variety Combo Pack - (Protein Bar Variety Box - 6 x 60 g and Snack Bar Variety Pack - 10 x 38 g and Breakfast Vari...,grocery & gourmet foods,https://m.media-amazon.com/images/W/IMAGERENDERING_521856-T1/images/I/61ROjHx4WWL._AC_UL320_.jpg,1398.0
"PNT Amritsari Handmade Crispy Premium Wadiyan (Medium Pepper, 400g)",grocery & gourmet foods,https://m.media-amazon.com/images/W/IMAGERENDERING_521856-T1/images/I/71ufIFp-ZcL._AC_UL320_.jpg,599.0
BOLA Jumbo Sized Cashew W180 1Kg (2x500g),grocery & gourmet foods,https://m.media-amazon.com/images/W/IMAGERENDERING_521856-T1/images/I/61bgx9CN6VL._AC_UL320_.jpg,1800.0
Nutribee 100% Multigrain Millet Rusk - Chilli Garlic | Refined Sugar-Free | Healthy Diet Toast | No Maida and Sugar | No P...,grocery & gourmet foods,https://m.media-amazon.com/images/W/IMAGERENDERING_521856-T1/images/I/81w8e8EMLOL._AC_UL320_.jpg,250.0
Nutri Desire Dry Figs Anjeer 1kg,grocery & gourmet foods,https://m.media-amazon.com/images/W/IMAGERENDERING_521856-T1/images/I/71Gzh4UgcLS._AC_UL320_.jpg,1299.0
Nutraj Premium Dry Fruits Combo Pack of Cashews & Raisins 250g Each | Kaju | Kishmish | Combo Pack | Nutritious & Deliciou...,grocery & gourmet foods,https://m.media-amazon.com/images/W/IMAGERENDERING_521856-T1/images/I/71FWbOEyxOL._AC_UL320_.jpg,998.0
"Dhampure Speciality Gur Jaggery Atta Cookies Biscuit, 400grams (2 x 200g) | Pure Gur Gud Bakery Whole Wheat Flour Baked Co...",grocery & gourmet foods,https://m.media-amazon.com/images/W/IMAGERENDERING_521856-T1/images/I/81G-F2lrwbL._AC_UL320_.jpg,398.0
Nxtgen Ayurveda Niger Seeds Raw 200g- Pack of 2 (400 gm),grocery & gourmet foods,https://m.media-amazon.com/images/W/IMAGERENDERING_521856-T1/images/I/61ZjQh4b3DL._AC_UL320_.jpg,200.0
"Minimal Sugar Coated Fennel Seeds/Fennel Candy/Sugar Coated Saunf,1kg",grocery & gourmet foods,https://m.media-amazon.com/images/W/IMAGERENDERING_521856-T1/images/I/81QQIh9DabL._AC_UL320_.jpg,399.0
ADH AMRITSARI Urad Dal Badi Khatti | Khatto Amritsari Wadi / Vadiyan | Udad Dal Bari / Wadi / Vadi / Wadiyan / Amritsari P...,grocery & gourmet foods,https://m.media-amazon.com/images/W/IMAGERENDERING_521856-T1/images/I/91U1b3lUxXL._AC_UL320_.jpg,120.0
Vellanki Foods Namkeen Chegodi (250gms) Pack of 2,grocery & gourmet foods,https://m.media-amazon.com/images/W/IMAGERENDERING_521856-T1/images/I/51K33s2A30L._AC_UL320_.jpg,363.0
Dizzle Mouth Freshener Navratan Mix (150gm) (Pack of Two) (Mint),grocery & gourmet foods,https://m.media-amazon.com/images/W/IMAGERENDERING_521856-T1/images/I/61fUH0JVDPL._AC_UL320_.jpg,364.0
"Rasily Sweet Soft Supari - Mouth Freshener, Digestive and Hygienically Packed After-Meal Snack .100g Pack of 1",grocery & gourmet foods,https://m.media-amazon.com/images/W/IMAGERENDERING_521856-T1/images/I/71dqO3fhgAL._AC_UL320_.jpg,120.0
PRAGYA DRY FRUITS Tutti Frutti for Cake 400gm | Tuti Fruti | Cherries | Cherry,grocery & gourmet foods,https://m.media-amazon.com/images/W/IMAGERENDERING_521856-T1/images/I/815bgRMMYyL._AC_UL320_.jpg,299.0
"Bhujialalji Chiwda Mixture, Chana Jor Namkeen, Aloo Bhujia, Khatta Meetha (pack of 4) 600g Namkeen Snacks Tasty & Crunchy ...",grocery & gourmet foods,https://m.media-amazon.com/images/W/IMAGERENDERING_521856-T1/images/I/51mZdrxA4cL._AC_UL320_.jpg,218.0
MiniMall Super Market Green Salty Masala Peas/Vatana 1 Kg - Namkeen Peas,grocery & gourmet foods,https://m.media-amazon.com/images/W/IMAGERENDERING_521856-T1/images/I/71M3X6em4yL._AC_UL320_.jpg,799.0
Bhujialalji Khatta Meetha And Navratan Mix (Combo pack of 2) 800g | Namkeen Snacks Tasty & Crunchy Tea-time Namkeen | All ...,grocery & gourmet foods,https://m.media-amazon.com/images/W/IMAGERENDERING_521856-T1/images/I/41kYgwWh+nL._AC_UL320_.jpg,240.0
GreenFinity Fresh Whole Roasted Salted Pistachios | Salted Pista With Shell 200g (Pack of 2) 400g Pista,grocery & gourmet foods,https://m.media-amazon.com/images/W/IMAGERENDERING_521856-T1/images/I/81fn2R1+XlL._AC_UL320_.jpg,1209.0
"Herbanuts Premium Jumbo Dried Apricot Seedless 1kg, Turkish Apricots, Apricots Dry Fruits, Apricots Dry Fruits",grocery & gourmet foods,https://m.media-amazon.com/images/W/IMAGERENDERING_521856-T2/images/I/71skIkADbbL._AC_UL320_.jpg,1699.0
"Fore Noon Vrat special FALAHARI cookies (GLUTEN free & GRAIN free) (Fasting & Upwas biscuit) ( made with Rajgira flour, Co...",grocery & gourmet foods,https://m.media-amazon.com/images/W/IMAGERENDERING_521856-T2/images/I/71RpnP5U4+L._AC_UL320_.jpg,499.0
Healthy Master Oats Chips with All Natural Ingredients| High in Fiber | Low in Sodium | Helps in Weight Loss | Gluten-Free...,grocery & gourmet foods,https://m.media-amazon.com/images/W/IMAGERENDERING_521856-T2/images/I/516hYhtJw-L._AC_UL320_.jpg,290.0
"Mr. Merchant Gulab Mukhwas, Traditional Mouth Freshener Mukhwas Mix (Pack of 1 (300gm Jar Pack))",grocery & gourmet foods,https://m.media-amazon.com/images/W/IMAGERENDERING_521856-T2/images/I/61cJHkCsFMS._AC_UL320_.jpg,300.0
Dilbahar's Yummy Digestive Jeera Goli 220g & Anardana Goli 210g Combo Pack of 2),grocery & gourmet foods,https://m.media-amazon.com/images/W/IMAGERENDERING_521856-T2/images/I/51s69bYhS5L._AC_UL320_.jpg,245.0
Flyberry Gourmet Kalmi Dates | Safawi Dates | Khajur/Khajoor Dry Fruit | Rich In Dietary Fibre | Best for Kids | High Sour...,grocery & gourmet foods,https://m.media-amazon.com/images/W/IMAGERENDERING_521856-T2/images/I/61ArzGiq4LL._AC_UL320_.jpg,1299.0
Prolicious 2X Protein Methi Flavour Khakra | NO Palm Oil | Crispy | Ready to Eat | Flavourful | High Protein Healthy Eveni...,grocery & gourmet foods,https://m.media-amazon.com/images/W/IMAGERENDERING_521856-T2/images/I/519Wfzy1UFL._AC_UL320_.jpg,480.0
"Sunfeast Bounce Cream Tangy Orange, 82g Pack of 20",grocery & gourmet foods,https://m.media-amazon.com/images/W/IMAGERENDERING_521856-T2/images/I/91pNXwojrAL._AC_UL320_.jpg,200.0
Aakash Laung Sev Namkeen | 900 Gm | Mouth Watering Clove Spice Taste | Soft & Spicy Namkeen | Healthy Indian Snacks | Indo...,grocery & gourmet foods,https://m.media-amazon.com/images/W/IMAGERENDERING_521856-T2/images/I/714lWzXv7cL._AC_UL320_.jpg,245.0
Freshly Baked Lactation Cookies to increase breastmilk supply | Best gift for new mothers | 6 different flavours | Assorte...,grocery & gourmet foods,https://m.media-amazon.com/images/W/IMAGERENDERING_521856-T2/images/I/61mlVzHJG5L._AC_UL320_.jpg,760.0
"Foodery Afghani Anjeer / Natural Healthy Anjir, Rich in Iron, Fibre, Vitamins and Increases Immunity (1 kg)",grocery & gourmet foods,https://m.media-amazon.com/images/W/IMAGERENDERING_521856-T2/images/I/81nI1b4auhL._AC_UL320_.jpg,899.0
"EXOTES, Walnuts Kernels Akhrot Giri Vacuum Packed Pouch g Pack of 1x250s, Natural, 250 Gram",grocery & gourmet foods,https://m.media-amazon.com/images/W/IMAGERENDERING_521856-T2/images/I/81xUmbZiaRL._AC_UL320_.jpg,500.0
"Spicy Carte Premium Cashews, 1Kg",grocery & gourmet foods,https://m.media-amazon.com/images/W/IMAGERENDERING_521856-T2/images/I/71FnuS7h4SL._AC_UL320_.jpg,999.0
Bhikharam Chandmal - Moong Dal - Namkeen - Indian Snacks - 375Gm Pack of 1,grocery & gourmet foods,https://m.media-amazon.com/images/W/IMAGERENDERING_521856-T2/images/I/71Z-VS6Tq9L._AC_UL320_.jpg,200.0
