name,main_category,image,actual_price
SFT Shezwan Flavoured & Roasted Makhana (Fox Nut Lotus Seed) 100 Gm,grocery & gourmet foods,https://m.media-amazon.com/images/I/71cPbZ5iFEL._AC_UL320_.jpg,245.0
Bethel Kerala Elite Jackfruit Pudding Cake 250 Gm,grocery & gourmet foods,https://m.media-amazon.com/images/I/51JYkQaqFHL._AC_UL320_.jpg,300.0
"Dry Fruit Hub Medjool Dates 500g Khajur/Khejur Medjool Dates,Medjoul Khajoor",grocery & gourmet foods,https://m.media-amazon.com/images/I/71k6scn0xES._AC_UL320_.jpg,1050.0
Naturals & Consumatic Jaggery Coated Banana Chips / Sharkkara Varatti / Sharkara Upperi) - 400g – Kerala Snack,grocery & gourmet foods,https://m.media-amazon.com/images/I/81e-AIiPj+L._AC_UL320_.jpg,319.0
Varya's Gluten Free Dal Samosa || Gluten Free|| Gluten Free Biscuits || Gluten Free Product,grocery & gourmet foods,https://m.media-amazon.com/images/I/71Hm50cT9KL._AC_UL320_.jpg,100.0
"Shree Namkeen Khatta Mitha Aloo Fariyali Mixture - Upwaas Mixture, Indore Special - 400gm.",grocery & gourmet foods,https://m.media-amazon.com/images/I/81ezSkj4vpL._AC_UL320_.jpg,200.0
"Nutty Gritties Rosted Unsalted Pumpkin Seeds for eating, Quality, Fibre-Rich Superfood, 200g (Pack of 1)",grocery & gourmet foods,https://m.media-amazon.com/images/I/71hJnllJCJL._AC_UL320_.jpg,285.0
Britannia 50-50 Biscuits - 200g Pouch,grocery & gourmet foods,https://m.media-amazon.com/images/I/71aQNEiECEL._AC_UL320_.jpg,200.0
The Organic Basket Jumbo Handpicked Lotus Seeds / Fox Nuts Big Size Phool Makhana (Pop / Gorgon Nut Puffed Kernels ) (Pack...,grocery & gourmet foods,https://m.media-amazon.com/images/I/31UBqekl1TL._AC_UL320_.jpg,799.0
Funtush Mouth Freshners Satrangee Mix 400gm,grocery & gourmet foods,https://m.media-amazon.com/images/I/61+2-CrYRtL._AC_UL320_.jpg,169.0
Nutritius Peanut Chocolate Hazelnut Sukhamewa & Mawa Malai Soft Chikki Set In Combo Packs (Pack Of 10),grocery & gourmet foods,https://m.media-amazon.com/images/I/61zaCktjMlL._AC_UL320_.jpg,660.0
Loacker Classic Wafer - Vanilla 45g - Italy,grocery & gourmet foods,https://m.media-amazon.com/images/I/51-YDpfUj+S._AC_UL320_.jpg,119.0
"Swiss Naturals Dried Chestnut/Dry Singhara/Singhada, 250g",grocery & gourmet foods,https://m.media-amazon.com/images/I/81mNYuVT8+L._AC_UL320_.jpg,399.0
Bishanlal Babulal | Plain Bikaneri Bhujia Bina Mirch| Healthy Snack Ready-to-Eat Savoury Namkeen| Rajasthani Bhujiya | No ...,grocery & gourmet foods,https://m.media-amazon.com/images/I/61AWCN64P4L._AC_UL320_.jpg,399.0
"ORION Choco Pie Chocolate Coated Biscuit, 4 x 6 piece pack (24 pies)| Korean snack",grocery & gourmet foods,https://m.media-amazon.com/images/I/716k8FP7DBL._AC_UL320_.jpg,320.0
"THE EDIBLES Roasted California Almonds 500 gm| Lightly Salted, Crunchy, Dry Roasted, Zero Oil, Non Fried | Big Sized Almon...",grocery & gourmet foods,https://m.media-amazon.com/images/I/61NFS0YldXL._AC_UL320_.jpg,899.0
Brown Supari |Roasted Supari |Sekel Sopari |Areca Nuts |Betel Nuts |Mouth Freshener |Mukhwash (200 gm),grocery & gourmet foods,https://m.media-amazon.com/images/I/618RbppoH5L._AC_UL320_.jpg,499.0
Bague Natural Fresh raw Organic Cashew Nuts kaju Cashews Whole cashewnuts w180 1000gm Grams 1 kg,grocery & gourmet foods,https://m.media-amazon.com/images/I/51pl6dzT5FL._AC_UL320_.jpg,2500.0
"Herbanuts Pumpkin Seeds 1Kg, for Eating, Rich in Protein & Fiber and Gluten Free, Pumpkin Organic Raw Seeds A Grade",grocery & gourmet foods,https://m.media-amazon.com/images/I/71e1a3XwiHL._AC_UL320_.jpg,1499.0
Sorich Organics Roasted Pumpkin Seeds and Flax Seeds Combo - 200 Gm (100Gm Each) - Weight Management | Improves Hair Growt...,grocery & gourmet foods,https://m.media-amazon.com/images/I/81Qbp-LiPCL._AC_UL320_.jpg,338.0
"Prakash Namkeen Mix Combo,750 grams, Indori Corn Mix +Gujrati Mix+ Khatta Meetha Mix (250Gram Each)",grocery & gourmet foods,https://m.media-amazon.com/images/I/61krWkQbRaL._AC_UL320_.jpg,600.0
"Miltop American Dried Blueberries, 100g",grocery & gourmet foods,https://m.media-amazon.com/images/I/81PEs4RF80L._AC_UL320_.jpg,285.0
"Maanki Poped Jowar/Ready To Eat Popcorn Dhani/Puffed Jovar Dhani, 250 g",grocery & gourmet foods,https://m.media-amazon.com/images/I/81tu-35RoPL._AC_UL320_.jpg,299.0
Food Essential Chana JOR Garam 1 kg.,grocery & gourmet foods,https://m.media-amazon.com/images/I/61I-xiTxbYL._AC_UL320_.jpg,649.0
"NatureVit California Almonds, 1 kg [Badam Dry Fruits]",grocery & gourmet foods,https://m.media-amazon.com/images/I/81agN3ah0WL._AC_UL320_.jpg,1500.0
Safe Products Kerala Fresh Home Made Jackfruit/Chakka Chips(400g),grocery & gourmet foods,https://m.media-amazon.com/images/I/817LK5nsRdL._AC_UL320_.jpg,449.0
"Nutritius Peanut Butter Chikki and Chocolate Chikki, 125g (10 Packs) - Family Pack",grocery & gourmet foods,https://m.media-amazon.com/images/I/51YOXA04WIL._AC_UL320_.jpg,575.0
"Thrayam Digestive Mukhwas, Roasted Sauf, Dhaniya Daal, Ajwain, Till, Suwa & Haldi (Mouth Fresheners)- 900 Grams",grocery & gourmet foods,https://m.media-amazon.com/images/I/61FuSmx1itL._AC_UL320_.jpg,1000.0
Roasted Salted Peanuts - | Roasted Salted Peanuts Seeds (Surendranagar Gujarat Special) Mungfali Dana (800 Gram),grocery & gourmet foods,https://m.media-amazon.com/images/I/51c5ROfvXIL._AC_UL320_.jpg,425.0
Siera Petha Dry Agra ka Petha | White Petha | Dry Sweet | Special Agra Petha ( Pack of 1) - 300 Gm,grocery & gourmet foods,https://m.media-amazon.com/images/I/61iBznpJwAL._AC_UL320_.jpg,399.0
GET FRESH Peanuts Roasted Salted Peanuts Seed Bharuch Gujrat Special Mungfali Dana Namkeen Skin Removed (1800 Gram),grocery & gourmet foods,https://m.media-amazon.com/images/I/51c5ROfvXIL._AC_UL320_.jpg,1000.0
"Abbie's Sweet Corn Kernels, 400 g (3)",grocery & gourmet foods,https://m.media-amazon.com/images/I/718au3ttzlL._AC_UL320_.jpg,297.0
"Purva's Premium Digestive Jeera Goli Mukhwas [Mouth Freshener, Digestive, Churan, Pachak, After-Meal Snack] Pack Of 3 | 30...",grocery & gourmet foods,https://m.media-amazon.com/images/I/71Bp5cIyZYL._AC_UL320_.jpg,225.0
"Ambrosia Organic Farm Amarnath Rice Cakes | Biggest Pack | Vegan, All Natural, Gluten Free (Pack of 1)",grocery & gourmet foods,https://m.media-amazon.com/images/I/61vZp7oqRnL._AC_UL320_.jpg,200.0
EasyBee Pumpkin Seeds for Eating 900g Green Raw,grocery & gourmet foods,https://m.media-amazon.com/images/I/816ZNKvrXeL._AC_UL320_.jpg,1050.0
Daily Treats Jackfruit|Chakka Chips 300g,grocery & gourmet foods,https://m.media-amazon.com/images/I/61VgXJiy9XL._AC_UL320_.jpg,300.0
kevalya White Madrasi Saunf Saunf Churi Home Made Mukhwas Mouth Freshener | Hygienically Prepared And Packed | (400g),grocery & gourmet foods,https://m.media-amazon.com/images/I/8150wlvLfgL._AC_UL320_.jpg,399.0
Eat Anytime Mindful Helathy Raw Sunflower Seeds | High Protein & Fiber | Gluten Free | Healthy Snack For Breakfast & Diet...,grocery & gourmet foods,https://m.media-amazon.com/images/I/71jCYHm1vvS._AC_UL320_.jpg,325.0
Roasted Peanuts (Khari Sing) - Vacuum Pack / Roasted Salted Peanuts Seeds (Bharuch Gujrat Special) Mungfali Dana Namkeen V...,grocery & gourmet foods,https://m.media-amazon.com/images/I/717kVXqnN7L._AC_UL320_.jpg,399.0
Nutty Gritties Mix Berries Blueberries Combo(Mix Berries +Blueberries 200g-Each) - 350g,grocery & gourmet foods,https://m.media-amazon.com/images/I/71ye+ZPpTHL._AC_UL320_.jpg,870.0
Spice Platter Special Hing Moongbadi || Mangodi || Moong Wadi || Mangori || 800g - Pack of 2 - 400g Each,grocery & gourmet foods,https://m.media-amazon.com/images/I/41rc4EV12AL._AC_UL320_.jpg,280.0
MiniMall Super Market Roasted Fennel Seeds (Saunf) with Dhana Daal/Deluxe Mouth Freshener (1 Kg),grocery & gourmet foods,https://m.media-amazon.com/images/I/71LrAvXBcyL._AC_UL320_.jpg,899.0
Selz Emperor Deseeded Black Dates (500 g),grocery & gourmet foods,https://m.media-amazon.com/images/I/71CMiYq1p9L._AC_UL320_.jpg,150.0
Happilo Premium Raw Authentic White Chia Seeds 250g ( Pack of 2 ) | Seeds for Eating | 100% Natural Fitness Mantra Chia Se...,grocery & gourmet foods,https://m.media-amazon.com/images/I/71UuAQSt5VL._AC_UL320_.jpg,550.0
"Sunshine nuts Pistachios Kernels Without Shell, Sada Pista (1kg)",grocery & gourmet foods,https://m.media-amazon.com/images/I/7175C9zTidL._AC_UL320_.jpg,1999.0
Organic Box Salted Pistachios Pista With Shell 900 Grams,grocery & gourmet foods,https://m.media-amazon.com/images/I/61guqBrj+GL._AC_UL320_.jpg,1999.0
"Glico Pocky Chocolate Cream Covered Biscuit Sticks, 47 g, 10 Pack",grocery & gourmet foods,https://m.media-amazon.com/images/I/610E89AOimL._AC_UL320_.jpg,1999.0
"Nutraj Dry Fruit Combo Almond, Cashews, Raisin, Walnut Kernels (100g Each, 400g) | Badam | Kaju | Akhroth giri | Nutritiou...",grocery & gourmet foods,https://m.media-amazon.com/images/I/81iJnaWhx4L._AC_UL320_.jpg,676.0
"Happilo Cranberry Cashews Healthy Dry Fruit Energy Bar Pack of 12 (15g each), Healthy Snack, High in Protein Nuts, No Adde...",grocery & gourmet foods,https://m.media-amazon.com/images/I/71U7QK-oR8L._AC_UL320_.jpg,360.0
RIGHTCRUNCH Amaranth (Rajgira) Crackers Baked & Gluten-free | Evening Tea-time Crunchy snack | Perfect with Chai | Easy to...,grocery & gourmet foods,https://m.media-amazon.com/images/I/81Qcx87eIvL._AC_UL320_.jpg,447.0
"NatureVit Pine Nut With Shell, 1 kg [Whole Chilgoza]",grocery & gourmet foods,https://m.media-amazon.com/images/I/71XGm0jLZbL._AC_UL320_.jpg,5000.0
"Hershey's Bar - Rakhi Gift Pack Hershey's Bar - Rakhi Gift (Milk Bar 100 gm & Cookies & Crème  100 gm + Rakhi ), 2 x 100",grocery & gourmet foods,https://m.media-amazon.com/images/I/61Ls9jPCTjL._AC_UL320_.jpg,267.75
"Kilobeaters Almond Nankhatai Cookies, Zero Sugar & Zero Preservatives - (100 gm)",grocery & gourmet foods,https://m.media-amazon.com/images/I/61uA78imvTL._AC_UL320_.jpg,228.0
"NUTRI DESIRE Dried Kiwi Fruit Slices 1kg |Kiwi Dry Fruits Gluten Free, Vegan & NON GMO",grocery & gourmet foods,https://m.media-amazon.com/images/I/61q-CnhVmtL._AC_UL320_.jpg,999.0
"Everpik Popular Raw California Almond (Badam),Value Pack 1kg(500G*2),100% Natural Premium",grocery & gourmet foods,https://m.media-amazon.com/images/I/6125oO59UyL._AC_UL320_.jpg,1499.0
Happilo Premium International Chilean Inshell Walnuts 500g | With Shell | Extra White Walnut | Resealable Package | All Na...,grocery & gourmet foods,https://m.media-amazon.com/images/W/IMAGERENDERING_521856-T1/images/I/71u53Xa4csL._AC_UL320_.jpg,599.0
"ketosy Premium and fresh Brazil Nuts, 200g",grocery & gourmet foods,https://m.media-amazon.com/images/W/IMAGERENDERING_521856-T1/images/I/81u-pUgCi+L._AC_UL320_.jpg,999.0
"Exotes Foods Best and Premium California Almonds/Badam Giri,, 250 g",grocery & gourmet foods,https://m.media-amazon.com/images/W/IMAGERENDERING_521856-T1/images/I/81D9jtAA41L._AC_UL320_.jpg,193.0
Nature's Bridge Hing Peda Pachak Heeng Tikiya Digestive Hing Peda Mukhwas Jar Pack - 400 Gm Heeng Candy,grocery & gourmet foods,https://m.media-amazon.com/images/W/IMAGERENDERING_521856-T1/images/I/71A+UlFf9BL._AC_UL320_.jpg,350.0
"Kanak International Healthy Nutmix 1Kg, ‎( Almonds, Black Raisins, Cashewnuts, Cranberries, Green Raisins, Pistachio Kerne...",grocery & gourmet foods,https://m.media-amazon.com/images/W/IMAGERENDERING_521856-T1/images/I/51ga0cuVGtL._AC_UL320_.jpg,1550.0
Kevalya ANARDANA CHHUHARA JEERA GOLI digestive mouth freshener tasty healthy - 200x3 g (Pack of 3),grocery & gourmet foods,https://m.media-amazon.com/images/W/IMAGERENDERING_521856-T1/images/I/91qIbW+e+-L._AC_UL320_.jpg,699.0
"Organic Grocery Mukhwas Mouth Freshener Calcutta Meetha Paan Gulkand - 900g | Handmade and Hygienically Packed, After Meal...",grocery & gourmet foods,https://m.media-amazon.com/images/W/IMAGERENDERING_521856-T1/images/I/81QNVebYc4L._AC_UL320_.jpg,499.0
Wheat Murmure | Wheat Puffed| Kurmure | Puri | Muri | Pori Non Roasted Snack Plain Murmure Healthy & Tasty Snack By Eywa S...,grocery & gourmet foods,https://m.media-amazon.com/images/W/IMAGERENDERING_521856-T1/images/I/81iMyN2RZIL._AC_UL320_.jpg,399.0
TruNaturals Puffed Amaranth Seeds 300g | Gluten Free Puffed Rajgira Seed | Puffed Rajgira Amaranth Seeds | Puffed Cholai |...,grocery & gourmet foods,https://m.media-amazon.com/images/W/IMAGERENDERING_521856-T1/images/I/71TQff48CyS._AC_UL320_.jpg,285.0
"Jyoti Ben's Namkeen Saloni Gujarati Chiwda, Mathri and Namkeen Combo Pack",grocery & gourmet foods,https://m.media-amazon.com/images/W/IMAGERENDERING_521856-T1/images/I/81t5GJEJzSL._AC_UL320_.jpg,750.0
Organic Farms Kimia Original Dates | Irani Kajoor Pack of 2 | 500 Gram Each | Regular Arabian Dates | 1kg Combo Pack (OF1),grocery & gourmet foods,https://m.media-amazon.com/images/W/IMAGERENDERING_521856-T1/images/I/81rqvKJ02eL._AC_UL320_.jpg,699.0
"Thank god it's organic California almonds 750gm , a+ top notch quality assured",grocery & gourmet foods,https://m.media-amazon.com/images/W/IMAGERENDERING_521856-T1/images/I/71tZcamOQ7L._AC_UL320_.jpg,949.0
"The Organic Basket Dried Amla Candy, Organic Dry Indian Gooseberry Fruit Without Added Sugar (PACK OF 900GM)",grocery & gourmet foods,https://m.media-amazon.com/images/W/IMAGERENDERING_521856-T1/images/I/71-wV4UpApL._AC_UL320_.jpg,699.0
SRI SAUHAM 100% Natural Premium 500Gr Whole Cashews | Premium Kaju nuts | Nutritious & Delicious | Whole Crunchy Cashew | ...,grocery & gourmet foods,https://m.media-amazon.com/images/W/IMAGERENDERING_521856-T1/images/I/81ocixIMpIL._AC_UL320_.jpg,615.0
Sri Sai Forestry Sky Fruit Seeds | Sugar Almonds | Adavi Badam | Akasha Pandu | Kadwa Badam Diabetes - 200 Seeds,grocery & gourmet foods,https://m.media-amazon.com/images/W/IMAGERENDERING_521856-T1/images/I/61kc-WXebbL._AC_UL320_.jpg,222.0
"Bliss of Earth Dehulled Sunflower Seeds 600gm For Eating & Weight Loss, Naturally Organic Superfood",grocery & gourmet foods,https://m.media-amazon.com/images/W/IMAGERENDERING_521856-T1/images/I/91zcb+IzLpL._AC_UL320_.jpg,385.0
Sorich Organics Dried Cranberries 200 Gm and Blueberries 150 Gm - 350 Gm - Diet Food | Dried Berries | Rich in Antioxidant...,grocery & gourmet foods,https://m.media-amazon.com/images/W/IMAGERENDERING_521856-T1/images/I/618BzOxsEMS._AC_UL320_.jpg,799.0
WONDER TASTE Combo of Gluten Free Methi Masala Plain Khakhra Pack of 4 (Each 200g) | Super Healthy Diet Low Calorie Snacks...,grocery & gourmet foods,https://m.media-amazon.com/images/W/IMAGERENDERING_521856-T1/images/I/71LOiNaaMeL._AC_UL320_.jpg,700.0
"Shara's Dry Fruits Broken Cashews Nuts Kaju Tukda, 250g - 4 Pieces",grocery & gourmet foods,https://m.media-amazon.com/images/W/IMAGERENDERING_521856-T1/images/I/51tZMPGuNDL._AC_UL320_.jpg,490.0
Shivanya Mart Kovilpatti Special Cocounut Milk Murukku - Diwali Festival Snacks - 250 Gram,grocery & gourmet foods,https://m.media-amazon.com/images/W/IMAGERENDERING_521856-T1/images/I/41wiY9VsnXL._AC_UL320_.jpg,299.0
Pmw - Grade A Non Roasted - Flax Seeds - Alsi - Alasi - Linseed - Avisa Ginjalu - 1Kilo - Loose Packed,grocery & gourmet foods,https://m.media-amazon.com/images/W/IMAGERENDERING_521856-T1/images/I/71Iiisl7nLL._AC_UL320_.jpg,499.0
"1 KG Walnuts 1kg Without Shell Akhoth Giri Quarter Kernels (Raw,500g x 2) VACUUM PACK",grocery & gourmet foods,https://m.media-amazon.com/images/W/IMAGERENDERING_521856-T1/images/I/71JFQBg3cnL._AC_UL320_.jpg,3000.0
SRN Naturals Premium Peanuts Raw | Pink | Organic Raw | Unpolished Ground Nut | 1Kg,grocery & gourmet foods,https://m.media-amazon.com/images/W/IMAGERENDERING_521856-T1/images/I/71XtIeiY9lL._AC_UL320_.jpg,399.0
Safe Products Kerala Sharkkara varatti (500G)/Upperi/Jaggery Coated Banana Chips,grocery & gourmet foods,https://m.media-amazon.com/images/W/IMAGERENDERING_521856-T1/images/I/91YiRFseQ-L._AC_UL320_.jpg,399.0
"Kurkure Namkeen Masala Munch, 50g [Pack of 15]",grocery & gourmet foods,https://m.media-amazon.com/images/I/817rZ3BUkdL._AC_UL320_.jpg,150.0
Nourish Organics Active Flax Seeds 180Gr,grocery & gourmet foods,https://m.media-amazon.com/images/I/81xqhCcObvL._AC_UL320_.jpg,
Brill Dried & Sweetened Apple 250g | Naturally Dried Apples | Apple Dry Fruits | 100% Natural | Vegan| Superfood with No P...,grocery & gourmet foods,https://m.media-amazon.com/images/I/61zG3jW5B7L._AC_UL320_.jpg,341.0
"Snackible Assorted Roasted Seeds Combo (Pack of 1 Each) | PeriPeri Pumpkin (40gm),PeriPeri Sunflower (50gm),Sriracha Pumpk...",grocery & gourmet foods,https://m.media-amazon.com/images/I/71KdZ3JwanL._AC_UL320_.jpg,410.0
Funtush Mouth Freshener Kesar Mix 400g Pack of 1,grocery & gourmet foods,https://m.media-amazon.com/images/I/61kUR7sbw5L._AC_UL320_.jpg,289.0
GJ White Pumpkin Juice - White Pumpkin Juice For Immunity Booster to Support Refresh Health.(500ml),grocery & gourmet foods,https://m.media-amazon.com/images/I/41IsQHVEWeL._AC_UL320_.jpg,510.0
Simply Raw Dry Fruits Pistachios Without Shell/ Pistachios Kernels/ Plain Pista Unsalted) (200 Gram),grocery & gourmet foods,https://m.media-amazon.com/images/I/71K8icKhwkL._AC_UL320_.jpg,599.0
"Herba Ajwa Dates 500gms (Khajoor/Khajur), Black Seedless Dates| All Natural | No Preservatives | No Added Sugar | Dates Dr...",grocery & gourmet foods,https://m.media-amazon.com/images/I/81NzyAnHByL._AC_UL320_.jpg,850.0
Markstor Exotic Chocolate Almond Dates [500 grams] - Roasted Almonds covered with Exotic Arabian Dates and laced with Fine...,grocery & gourmet foods,https://m.media-amazon.com/images/I/91ld2jP4GyL._AC_UL320_.jpg,1200.0
"Shellfeast Walnut Kernels Light Half 1 Kg ( Pack Of 2 ) In Food Grade Jar , Kashmiri Walnut Kernels, Akhrot Giri",grocery & gourmet foods,https://m.media-amazon.com/images/I/71R3FH362NL._AC_UL320_.jpg,8999.0
Nutri Desire Gujrat Mini Bhakarwadi (Crunchy and Tasty) 400gm,grocery & gourmet foods,https://m.media-amazon.com/images/I/51f15LcQFhL._AC_UL320_.jpg,399.0
"JEWEL FARMER Nuts & Berries Mix With Almonds, Cashew Nut, Pista, Broad Bean, Pumpkin Seed, Cranberry, Blueberry (200g)",grocery & gourmet foods,https://m.media-amazon.com/images/I/714Z88g5zjL._AC_UL320_.jpg,475.0
"Veeba Salsa Dip - Tomato, 360g",grocery & gourmet foods,https://m.media-amazon.com/images/I/81n8vPeWLTL._AC_UL320_.jpg,141.0
"Maniarrs Chocolate flavor slim bite wheat chips made with Natural Ingredient, Healthy snacks, High in protein, Zero preser...",grocery & gourmet foods,https://m.media-amazon.com/images/I/71hCaOcLAIL._AC_UL320_.jpg,150.0
"Spicy Carte Maryam Dates, 1Kg",grocery & gourmet foods,https://m.media-amazon.com/images/I/81t2vMJxNcL._AC_UL320_.jpg,999.0
"Fruitri Sweet and Crispy California Almonds, A Grade Badaam Giri 250,g",grocery & gourmet foods,https://m.media-amazon.com/images/I/51Ku3mW-UrL._AC_UL320_.jpg,399.0
Everyday Four Marbroom Dates Dry Fruits 400G | Worlds Finest | Khajoor Dates,grocery & gourmet foods,https://m.media-amazon.com/images/I/51TKYGe7IWS._AC_UL320_.jpg,740.0
SINDHI KAKO JEERA KHICHA (Handmade) Special Papads & Fried Accompaniments Akki Happala (Rice Flour Papad),grocery & gourmet foods,https://m.media-amazon.com/images/I/31-inF3mM5L._AC_UL320_.jpg,399.0
nutndiet Fresh Crunchy Cashews 500g Standard W320 Grade (kaju 500 gm W320) Cashews,grocery & gourmet foods,https://m.media-amazon.com/images/I/51HtPCmGsbL._AC_UL320_.jpg,650.0
Sweet Karam Coffee Thattai (Rice Crackers) 200g| Vegan | Gluten Free Crunchy Chips and Kids friendly healthy snacks.,grocery & gourmet foods,https://m.media-amazon.com/images/I/81TCkU9pmPL._AC_UL320_.jpg,129.0
KONDAJI CHIVADA(कोंडाजी चिवडा) | Vishal Bhel | Pack of 2- 250gm each (Total - 500Gms) | The Original flavour By Wavre Band...,grocery & gourmet foods,https://m.media-amazon.com/images/I/81iWZ0+iHLL._AC_UL320_.jpg,250.0
"Jouy & Co Cravingz Bear Chocolate 225g, 225 g (Pack of 1)",grocery & gourmet foods,https://m.media-amazon.com/images/I/71bZLPnwOIL._AC_UL320_.jpg,295.0
"SGK Turkish Apricots | Vegan, Sun Dried Apricots | Gluten Free & Sodium Free | Add in your Healthy Recipes 500 Gram",grocery & gourmet foods,https://m.media-amazon.com/images/I/81vxcm36wKL._AC_UL320_.jpg,1199.0
"Organic Farms Kimia Dates 1Kg Pack Of 2 Each 500g ,Mazafati Dates 100% Natural Soft Kimia Dates Original Kimia Dates,Dates...",grocery & gourmet foods,https://m.media-amazon.com/images/I/81rqvKJ02eL._AC_UL320_.jpg,699.0
We Care Eco Products Kerala Style Sweet & Ripened Banana Chips | Homemade and Ready to Eat | Healthy Indian Snacks | (250g),grocery & gourmet foods,https://m.media-amazon.com/images/I/91El-sUZfAL._AC_UL320_.jpg,399.0
"Godka™ Pure Pista Powder/Pistachio Powder,500 g",grocery & gourmet foods,https://m.media-amazon.com/images/I/416fptdIi9L._AC_UL320_.jpg,1149.0
"Khari Foods Organic Flax Seeds 1kg, Fat Loss, Omega 3 & Anti-oxidants Rich, Gluten Free",grocery & gourmet foods,https://m.media-amazon.com/images/I/61YHEV1lTQL._AC_UL320_.jpg,599.0
"Pringles Potato Crisps - Sour Cream & Onion, 107g",grocery & gourmet foods,https://m.media-amazon.com/images/I/710jQknlWgL._AC_UL320_.jpg,115.0
The Paratha & Ready Bites Special Gujarati Traditional Spicy Mixture Namkeen (Gujarati_Mix_1_Kg),grocery & gourmet foods,https://m.media-amazon.com/images/I/21q9iIcyi2L._AC_UL320_.jpg,999.0
"Nature Purify Dry Fruits Combo Almond + Pista - 250gm Each | Rich in Fibre, Boost Immunity Badam | Delicious, Roasted Pist...",grocery & gourmet foods,https://m.media-amazon.com/images/I/71jcmjihIBL._AC_UL320_.jpg,899.0
Cookieman Choc Chunk and Brandy Snap Cookies - 120g x 4 Packs Combo,grocery & gourmet foods,https://m.media-amazon.com/images/I/61hkGKhVJeL._AC_UL320_.jpg,438.0
Safe Products Kerala Tapioca Chips/Kappa Kolli [325 Gm] Healthy Namkeen Snacks,grocery & gourmet foods,https://m.media-amazon.com/images/I/81J2U-womZL._AC_UL320_.jpg,349.0
"Lagom Gourmet Seedless Dried Apricots, 250g | Sun Dried | No Added Sugar | Gluten Free | Vegan | Non GMO | Apricots Dry Fr...",grocery & gourmet foods,https://m.media-amazon.com/images/I/61uNe64EBvL._AC_UL320_.jpg,449.0
Nut Toppers Long seedless Green Raisins 500g Value Pack | Kishmish 500g | kismis 500gm | Premium natural green raisins |,grocery & gourmet foods,https://m.media-amazon.com/images/I/81EuIHzGsdL._AC_UL320_.jpg,310.0
Yamu's Panchayat Jasmine Supari (100gm),grocery & gourmet foods,https://m.media-amazon.com/images/I/41EcAm53vbL._AC_UL320_.jpg,120.0
Delinut Peanuts - 80 Grams Pouch– Hygienically Packed – Salted Oil Roasted Peanuts 400g (5x80g),grocery & gourmet foods,https://m.media-amazon.com/images/I/71BsplNgD0L._AC_UL320_.jpg,190.0
Vellanki Foods Andhra Sweets Venna Vundalu(500gms),grocery & gourmet foods,https://m.media-amazon.com/images/I/51UCkWXz+VL._AC_UL320_.jpg,363.0
"ADOR Health Active Diabetes and Obesity Remission Ador Health Ultra Low Carb Methi Khakhra-| Keto Friendly, 400 Grams",grocery & gourmet foods,https://m.media-amazon.com/images/I/71UnyIEx4EL._AC_UL320_.jpg,399.0
"PYRAMID TRADERS Kashmiri Mamra Almond in Shell, Sabut soft (Kagzi) (1 kg)",grocery & gourmet foods,https://m.media-amazon.com/images/I/61-R+9HdmRL._AC_UL320_.jpg,1200.0
"Britannia Nutri Choice High Fibre Digestive Biscuits, 250 g Pack of 4",grocery & gourmet foods,https://m.media-amazon.com/images/I/71WegH0bpJL._AC_UL320_.jpg,300.0
Bhikharam Chandmal - Liliput Kachori - Maida Namkeen - Tea Snacks - Indian Snacks - 375Gm Pack of 1,grocery & gourmet foods,https://m.media-amazon.com/images/I/714ExUJsAyL._AC_UL320_.jpg,229.0
Gujarati Namkeen South Indian Chakli/Spicy Chakli/Indian Snacks/Homemade Namkeen- 400 grams,grocery & gourmet foods,https://m.media-amazon.com/images/I/711tUnlS-iL._AC_UL320_.jpg,499.0
RR Agro Foods Basil Seeds 500 GM | Tukmariya | Falooda Seeds | Basil Seeds for Weight Loss Pack of 1,grocery & gourmet foods,https://m.media-amazon.com/images/I/61gzaRm40IL._AC_UL320_.jpg,499.0
"Agrawal's 420 Plain/Sada Papad,200 Gram Pack of 5",grocery & gourmet foods,https://m.media-amazon.com/images/I/41X0NRNjm2L._AC_UL320_.jpg,349.0
"Urban Platter Yeast Extract Powder Shaker Jar, 70g / 2.5oz [Cheesy Flavour, Vegan-Friendly]",grocery & gourmet foods,https://m.media-amazon.com/images/I/718XaMKrYCL._AC_UL320_.jpg,300.0
Happilo Premium International Chilean Inshell Walnuts 500g | With Shell | Extra White Walnut | Resealable Package | All Na...,grocery & gourmet foods,https://m.media-amazon.com/images/I/71u53Xa4csL._AC_UL320_.jpg,599.0
"ketosy Premium and fresh Brazil Nuts, 200g",grocery & gourmet foods,https://m.media-amazon.com/images/I/81u-pUgCi+L._AC_UL320_.jpg,999.0
Jyoti Ben's Mukhwas - Combo of Roasted Saunf with Dhaniya Daal - Ajwain & Roasted Saunf with Dhaniya Daal - Till,grocery & gourmet foods,https://m.media-amazon.com/images/I/81FOCfqKvxL._AC_UL320_.jpg,700.0
Haldiram's Nagpur Chocolate Chip Cookies (Pack of 2-250 gm Each),grocery & gourmet foods,https://m.media-amazon.com/images/I/61WGxYurRqS._AC_UL320_.jpg,400.0
"Ratan Sev Bhandar Masala Mixture - Pack of 2, 250gm",grocery & gourmet foods,https://m.media-amazon.com/images/I/91LymHP7OSL._AC_UL320_.jpg,160.0
Twix Single (Pack of 10) 500g,grocery & gourmet foods,https://m.media-amazon.com/images/I/61zEh7j90TS._AC_UL320_.jpg,600.0
Mcvitie's Jaffa Cakes 10 Pack - 122g - Pack of 2,grocery & gourmet foods,https://m.media-amazon.com/images/I/71WuQF29eyL._AC_UL320_.jpg,1500.0
"Dry Fruit Hub Banana Chips 1Kg, Kerala Banana Chips, Banana Chips Snacks, Banana Waffers, Banana Chips, Kerala Banana Chip...",grocery & gourmet foods,https://m.media-amazon.com/images/I/719sEzobIeL._AC_UL320_.jpg,650.0
Shree Saatvik Pudina Vita,grocery & gourmet foods,https://m.media-amazon.com/images/I/61XO5tqQc6L._AC_UL320_.jpg,110.0
"Nova Nova Tarts - Assorted Gift Box| Vegetarian, 100% Eggless | With No Added Preservatives | Freshly Baked For Your Order...",grocery & gourmet foods,https://m.media-amazon.com/images/I/71HcV078UKL._AC_UL320_.jpg,649.0
"OOSH Seedless Black Raisin, 3 x 250 g | Kali Kishmish | Munakka Dry Fruits | Delicious & Healthy Snack | High in Antioxida...",grocery & gourmet foods,https://m.media-amazon.com/images/I/71j5sag-EvL._AC_UL320_.jpg,750.0
Dungarji Traditionally Roasted Salted Peanuts Snack And Namkeen (1kg),grocery & gourmet foods,https://m.media-amazon.com/images/I/61G8pqvhC+L._AC_UL320_.jpg,383.0
