name,main_category,image,actual_price
Naturo Fruit Bar - Mango Fruit Bar Pouches - 7g x 6 ( Pack of 15),grocery & gourmet foods,https://m.media-amazon.com/images/W/IMAGERENDERING_521856-T2/images/I/61tRt8bprDL._AC_UL320_.jpg,450.0
Pickwick Orange Flavored Wafer Biscuits Pack of (200gm×2),grocery & gourmet foods,https://m.media-amazon.com/images/W/IMAGERENDERING_521856-T2/images/I/51vM4dTJadL._AC_UL320_.jpg,200.0
SAPPHIRE FOODS Berries & Nuts Premium Dried Blackberries BlackBerry Without Seeds (1 kg),grocery & gourmet foods,https://m.media-amazon.com/images/W/IMAGERENDERING_521856-T2/images/I/71keGLFDJrL._AC_UL320_.jpg,2799.0
"Royal Dansk Choco-Chip Cookies 340g || Danish Cookies from Denmark in Iconic Blue Tin || Cookies for Tea Time, Snacks, & G...",grocery & gourmet foods,https://m.media-amazon.com/images/W/IMAGERENDERING_521856-T2/images/I/81y4sbUqi8L._AC_UL320_.jpg,550.0
"Nutriplato-enriching lives Raw Black Chia Seeds, 500 g",grocery & gourmet foods,https://m.media-amazon.com/images/W/IMAGERENDERING_521856-T2/images/I/61kysYFRorL._AC_UL320_.jpg,499.0
"Sonav Foods Sacha inchi seeds are rich in protein, fiber, and heart healthy fats. They also contain several essential micr...",grocery & gourmet foods,https://m.media-amazon.com/images/W/IMAGERENDERING_521856-T2/images/I/91AaN0C7Q3L._AC_UL320_.jpg,999.0
"VAAIMAI Onion Ring Fryums - Onion Ring Shaped Fryums-Tasty Ready to Fry Fryums, 250g",grocery & gourmet foods,https://m.media-amazon.com/images/W/IMAGERENDERING_521856-T2/images/I/71VzskpHKiS._AC_UL320_.jpg,249.0
Bonn Coconut crunch biscuits|Pack of 20|1520 Grams,grocery & gourmet foods,https://m.media-amazon.com/images/W/IMAGERENDERING_521856-T2/images/I/616xsrUq8cL._AC_UL320_.jpg,200.0
Bhuira|All Natural Jam Grapefruit Marmalade|No Added preservatives|No Artifical Color Added|240 g|Pack of 1,grocery & gourmet foods,https://m.media-amazon.com/images/W/IMAGERENDERING_521856-T2/images/I/81dmQAHX4ZL._AC_UL320_.jpg,249.0
"Sun Grow Organic Homemade/Mother Made Stuffed Banarasi Red Chilli Pickle Achaar, 1 kg",grocery & gourmet foods,https://m.media-amazon.com/images/W/IMAGERENDERING_521856-T2/images/I/81OabtTm5RL._AC_UL320_.jpg,599.0
FARM 2 YOU Udad Special Sindhi Papad 400GM,grocery & gourmet foods,https://m.media-amazon.com/images/W/IMAGERENDERING_521856-T2/images/I/41l5HQd-IXL._AC_UL320_.jpg,300.0
Eco Herbs Dried Coconut Ball Copra Gola Gota Sukha Nariyal Naturally Sun Dried Whole Coconut Kobbari Sabut Nariyal 1 Kg,grocery & gourmet foods,https://m.media-amazon.com/images/W/IMAGERENDERING_521856-T2/images/I/71OI3zBiDzL._AC_UL320_.jpg,599.0
Delight Foods Ripe Jackfruit Chips (Vacuum Fried) - 100g,grocery & gourmet foods,https://m.media-amazon.com/images/W/IMAGERENDERING_521856-T2/images/I/61ERJEImehL._AC_UL320_.jpg,260.0
Svasti Roasted Bajri Methi Garlic Bhakhri | Whole Wheat Crisps | Healthy Traditional Gujarati Snacks | Ready To Eat |Vacuu...,grocery & gourmet foods,https://m.media-amazon.com/images/W/IMAGERENDERING_521856-T2/images/I/71OqwT3oSfL._AC_UL320_.jpg,340.0
"nakd. Cocoa Delight - Raw Fruit & Nut Bars - 100% Natural Ingredients - No Added Sugar, Vegan - 4 x 35g",grocery & gourmet foods,https://m.media-amazon.com/images/W/IMAGERENDERING_521856-T2/images/I/61MKLAZuITL._AC_UL320_.jpg,599.0
"Cantina Taco Shell 12 pcs , 150g",grocery & gourmet foods,https://m.media-amazon.com/images/W/IMAGERENDERING_521856-T2/images/I/81dUyKjTTJL._AC_UL320_.jpg,195.0
Bhavani Foods SSV Super Nuts (Coconut Milk Flavored Very Crispy Peanuts) (Coconut Milk Coated) Pack of 8 (100 GMS Each Pack),grocery & gourmet foods,https://m.media-amazon.com/images/W/IMAGERENDERING_521856-T2/images/I/81LmBtzcx9L._AC_UL320_.jpg,480.0
Paper Boat Vrat Dry Fruits Combo I Kaju Badam I Dry Fruits I Navratri Special Food I Namkeen I 200g X 4,grocery & gourmet foods,https://m.media-amazon.com/images/W/IMAGERENDERING_521856-T2/images/I/61RIJHN29EL._AC_UL320_.jpg,1420.0
"Prakash Namkeen Combo Pack, 1.5 KG - All in One Mixture + Pyaz Mix + Khatta Mitha Mixture + Gujarati Mixture + Indori Corn...",grocery & gourmet foods,https://m.media-amazon.com/images/W/IMAGERENDERING_521856-T2/images/I/91FlqWL28MS._AC_UL320_.jpg,1200.0
"Fruitri Baker's Pride Kashmiri Walnut without shell, Akhrot Giri,16 Pcs, Vacuumed Pack - 1kg",grocery & gourmet foods,https://m.media-amazon.com/images/W/IMAGERENDERING_521856-T2/images/I/81aeMkE7V8L._AC_UL320_.jpg,999.0
"POLKA HIGH Fibre Atta Cookies Biscuit , Whole Wheat Digestive Biscuit ,400 Gm ,Cookies Biscuit ,Flavour Cookie , Atta biscuit",grocery & gourmet foods,https://m.media-amazon.com/images/W/IMAGERENDERING_521856-T2/images/I/41QupcMlgYL._AC_UL320_.jpg,250.0
"Dry Fruit Hub Dried Kiwi 500gm, Dried Kiwi Dry Fruits,Candied Dried Kiwi Fruit Slices,Fresh Kiwi Dry Fruits (Gluten Free, ...",grocery & gourmet foods,https://m.media-amazon.com/images/I/71f1n3L1y8L._AC_UL320_.jpg,950.0
"Gladful Try Them All Choco-chip, Cashew & Coconut Protein Cookies - Biscuits Pack for kids and families (80g , Pack of 8)",grocery & gourmet foods,https://m.media-amazon.com/images/I/81HSGEluIbL._AC_UL320_.jpg,1200.0
SUN NUTRITION Afghani Anjeer Figs (Dried Figs) Dry Fruits (900 gram),grocery & gourmet foods,https://m.media-amazon.com/images/I/518pmQOydcL._AC_UL320_.jpg,1096.0
"Nutriwish Barley Grass Powder, 100g",grocery & gourmet foods,https://m.media-amazon.com/images/I/61BRAwStiNL._AC_UL320_.jpg,330.0
Royal Dates 1kg | Dates 1kg | Lion Dates 1kg | Medjool dates |Jordan Dates |Medjool dates 1kg | Dates Royal | Dates | Lion...,grocery & gourmet foods,https://m.media-amazon.com/images/I/61ViOqVtSLL._AC_UL320_.jpg,1600.0
Organic Nuts Fresh Premium Whole Plain Cashew Nuts | Kaju/Cashew Dry Fruit Nuts 500g,grocery & gourmet foods,https://m.media-amazon.com/images/I/71v-LpUsu3L._AC_UL320_.jpg,699.0
Chocolate Tapioca Pearls 500 gms Boba Bubble Tea,grocery & gourmet foods,https://m.media-amazon.com/images/I/51z8OCKjl+L._AC_UL320_.jpg,500.0
"Afters by Happy Jars Orange Burst Healthy Dessert Bites - One Bite Craving Killer (7 pieces, 25g each)",grocery & gourmet foods,https://m.media-amazon.com/images/I/51bPBqIc-tL._AC_UL320_.jpg,350.0
"Al Qusai Kalmi / Safawi Dates,Saudi Arabia (Kalmi 500g Tin)",grocery & gourmet foods,https://m.media-amazon.com/images/I/71Fs7NmHq-L._AC_UL320_.jpg,650.0
Dizzle Mouth Freshener Tini Mini 255 g Pack of 3,grocery & gourmet foods,https://m.media-amazon.com/images/I/61gki91JnwL._AC_UL320_.jpg,375.0
"Organic Tattva -Organic Amla (Indian Gooseberry) Powder 200 Gram | Rich in Vitamin C, Calcium, Iron and Amino Acids | Boos...",grocery & gourmet foods,https://m.media-amazon.com/images/I/81hYr88ClJL._AC_UL320_.jpg,270.0
Arvachin Bedekar Papad Masala - 200 Grams (100 Grams x 2 Nos),grocery & gourmet foods,https://m.media-amazon.com/images/I/41Y+TmNbaiL._AC_UL320_.jpg,110.0
"Ancy Foods Indian Green Raisins (Kishmish) , 2 X 250 g",grocery & gourmet foods,https://m.media-amazon.com/images/I/81NMdUFq3GL._AC_UL320_.jpg,176.0
Flavours of Calicut - Onam Special Combo - Banana Chips (250g) & Jaggery Coated Banana Chips (250g) - 500g,grocery & gourmet foods,https://m.media-amazon.com/images/I/71JTTnwrCML._AC_UL320_.jpg,399.0
PUSHKARAJ INDUSTRIES RAGI MALT -250g - PACK OF 3 (KESHAR PISTA + BERRIES + MANGO),grocery & gourmet foods,https://m.media-amazon.com/images/I/81B2vSm0vYL._AC_UL320_.jpg,270.0
Sasta Kashmiri walnut without shell in vacuum pack (Akhrot giri) (500 GRAMS),grocery & gourmet foods,https://m.media-amazon.com/images/I/61-JhZhNBZL._AC_UL320_.jpg,800.0
"BONVIE Freeze dried fruits mix | Real Banana Fruits Healthy Snacks for Kids and Adults | No Added Sugar, Gluten Free, No P...",grocery & gourmet foods,https://m.media-amazon.com/images/I/71Z0r8qoPFL._AC_UL320_.jpg,125.0
MINI MALL SUPER MARKET Healthy Heart Iced Gem /Cream Biscuit - 500 Gm,grocery & gourmet foods,https://m.media-amazon.com/images/I/81G3xigGPrL._AC_UL320_.jpg,599.0
"EXOTES Pista Roasted & Salted Vacuum Packed Popular Pouch, 500 g",grocery & gourmet foods,https://m.media-amazon.com/images/I/71eFW8YIdpL._AC_UL320_.jpg,1000.0
URBANS 200G Export Qaulity Roasted N Salted Cashews Large Kernels Whole Big Size Nut Premium Kaju TIN W240 Grade (200gram),grocery & gourmet foods,https://m.media-amazon.com/images/I/81Pn1ywoq2L._AC_UL320_.jpg,385.0
Dhawak Kashmiri Walnut Broken 8 Pcs. Without Shell 500 Gms. Akhrot Giri | Walnut Giri [Jar Pack],grocery & gourmet foods,https://m.media-amazon.com/images/I/61-OzV1FhEL._AC_UL320_.jpg,800.0
"Indiana Sliced California Almonds, Roasted (Badam Flakes for Topping on cake,milk,salads) (100gm)",grocery & gourmet foods,https://m.media-amazon.com/images/I/41Wda-zEaJL._AC_UL320_.jpg,400.0
"SHREGO Peanut Plus Mexican Chipotle Roasted Peanut, Snack and Namkeen, Vacuum Packed (360 Gm)",grocery & gourmet foods,https://m.media-amazon.com/images/I/71yHZbj8TsL._AC_UL320_.jpg,250.0
Chheda's - SOYA Snax - SOYA Sticks - Masala chakli - 350 Gm Pack of 1,grocery & gourmet foods,https://m.media-amazon.com/images/I/61kaSDQOvhL._AC_UL320_.jpg,215.0
Fruitri Handpicked unroasted Flax Seeds 1kg - Fiber Rich Raw Flax Seeds for Hair Growth and Weight Management| Alsi Seeds...,grocery & gourmet foods,https://m.media-amazon.com/images/I/819G6W3G6AL._AC_UL320_.jpg,399.0
NRIP Gurbandi Giri Almond (Badam) [ Rich in Oil so Bitter in Taste ] 200 Gm,grocery & gourmet foods,https://m.media-amazon.com/images/I/81WNzyK1AzL._AC_UL320_.jpg,400.0
"POLKA JEERA FINGER COOKIES ,200 GM ,SUGARLESS NAMKEEN BISCUIT ,CHAI TIME SNACKS ,NAMKEEN SNACK .",grocery & gourmet foods,https://m.media-amazon.com/images/I/71qgmTSGOQL._AC_UL320_.jpg,269.0
"NatureVit Pine Nut With Shell, 100gm (Whole Chilgoza)",grocery & gourmet foods,https://m.media-amazon.com/images/I/71XGm0jLZbL._AC_UL320_.jpg,800.0
"Snackible Ragi Chips - Assorted Combo (Pack of 1 Each) - 3x180gm | Jalapeno, Peri Peri, Spiced | Gluten Free | Reduces Cho...",grocery & gourmet foods,https://m.media-amazon.com/images/I/71iA-qIvcxL._AC_UL320_.jpg,420.0
Nutraj Signature - Greek Black Currant Dried 100G (Pack of 3) - Vacuum Pack,grocery & gourmet foods,https://m.media-amazon.com/images/I/818qVAbCfCL._AC_UL320_.jpg,297.0
Babus Laxminarayan Fresh & Delicious Combo Of Poha Chiwda & Cornflakes Chiwda (2 Count)_500Gm,grocery & gourmet foods,https://m.media-amazon.com/images/I/81Ll-eiCaLL._AC_UL320_.jpg,200.0
"LittleVeda Mom's Bar for Breastfeeding Mother's - Panjeeri Coconut (Pack of 6X40g) - Improve lactation with Oats, Gondh, S...",grocery & gourmet foods,https://m.media-amazon.com/images/I/71f0uZ2rzML._AC_UL320_.jpg,594.0
Shree Namkeen Mix Mixture - Indore Special - Crispy & Crunchy - 400gm. (Pack of 2),grocery & gourmet foods,https://m.media-amazon.com/images/I/81TUrnRWUtL._AC_UL320_.jpg,400.0
RAJA BRAND AMRITSARI KHATTA MEETHA AAM PAPAD-(200GM),grocery & gourmet foods,https://m.media-amazon.com/images/I/41pEmSO1MiL._AC_UL320_.jpg,300.0
"FAMILY NUTS Dry Salted Cashew Roasted (400g) Kaju Dry Oven Roasted , Non Fried, Oil Free - Premium Crunchy Kaju Snack (400...",grocery & gourmet foods,https://m.media-amazon.com/images/I/71mrODyqkFL._AC_UL320_.jpg,999.0
"Anna Vedaa Raw Peanuts, Pink, 1kg",grocery & gourmet foods,https://m.media-amazon.com/images/I/618lvCXb8BL._AC_UL320_.jpg,216.0
"4700BC Instant Popcorn, Butter, Pouch, 900g, (Pack of 10)",grocery & gourmet foods,https://m.media-amazon.com/images/I/6156pFMZd5L._AC_UL320_.jpg,300.0
"Eighty7 Raisins and Cashews Combo(250 gms each), 500g",grocery & gourmet foods,https://m.media-amazon.com/images/I/51uv5mNrJXL._AC_UL320_.jpg,582.0
PAANSMITH SHAHI CALCUTTA PAAN 220g - AFTER-MEAL DIGESTIVE | MUKHWAS | MOUTH FRESHENER,grocery & gourmet foods,https://m.media-amazon.com/images/I/51+39FpnWVL._AC_UL320_.jpg,240.0
Paper Boat Premium Healthy Snack Combo: Smoked & Roasted Nuts with Himalayan Pink Salt + Honey Glazed Nuts with Sesame See...,grocery & gourmet foods,https://m.media-amazon.com/images/I/61imQXL6zfL._AC_UL320_.jpg,370.0
Ajwa Dates 1kg Grade A Dry Fruit Khajoor | Revneo Original Al Ajwa Dates Khajur from Madina Saudi Arabia,grocery & gourmet foods,https://m.media-amazon.com/images/I/71jBAcY-1TL._AC_UL320_.jpg,8999.0
"Urban Platter Hing Peda Mukhwas, 350g / 12.3oz [ Mouth Freshener, Digestive, After-Meal Snack]",grocery & gourmet foods,https://m.media-amazon.com/images/I/71YAunkXzJL._AC_UL320_.jpg,400.0
Happilo Premium Seedless Afghani Green Raisins 200 g (Pack of 2),grocery & gourmet foods,https://m.media-amazon.com/images/I/71TUQElzz5L._AC_UL320_.jpg,490.0
"GleeVita Millet Crunchies - Ragi Sesame Balls & Vanilla Loops | Goodness of Millets & Jaggery | No Maida, No Refined Suga...",grocery & gourmet foods,https://m.media-amazon.com/images/I/71Q+BOxXcpL._AC_UL320_.jpg,298.0
Vimal Elaichi Saffron Blended | Premium | Elaichi Dana | Fresh Breath | Silver Cardamom| Mouthfreshner | Pure Cardamom | (...,grocery & gourmet foods,https://m.media-amazon.com/images/I/71bEIofBk7L._AC_UL320_.jpg,
Thangapandiyan Special Masala Kadalai (Peanuts) Pack of 3 x 250gm,grocery & gourmet foods,https://m.media-amazon.com/images/I/81h3xk2268S._AC_UL320_.jpg,402.0
"Toshewala Simply Delicious Tosha, 800 GMS",grocery & gourmet foods,https://m.media-amazon.com/images/I/81W2MT7N1GL._AC_UL320_.jpg,570.0
"4700BC Instant Popcorn, BBQ, Pouch, 900g, (Pack of 30)",grocery & gourmet foods,https://m.media-amazon.com/images/I/61VTuKjhJ4L._AC_UL320_.jpg,300.0
"Being Marwari Supari Mouth Freshner (Sweet Supari), 400g",grocery & gourmet foods,https://m.media-amazon.com/images/I/51K87g9lrtS._AC_UL320_.jpg,1000.0
Native Tongue Strawberry Preserve with Kerala Vanilla | 100% Natural Strawberries Jam | 70% Fruit | No preservatives | No ...,grocery & gourmet foods,https://m.media-amazon.com/images/I/61i0ZUpPs3L._AC_UL320_.jpg,325.0
Unibic Snappers | Potato Biscuits | Chatpata Achari Mango Flavoured | All time Snacking,grocery & gourmet foods,https://m.media-amazon.com/images/I/61DZ0LAAebL._AC_UL320_.jpg,450.0
"RELEZA CASHEW NUTS BROKEN 500 GM 4 PIECES KAJU TUKDA/FADA/LWP CASHEWS IN NUTS AND DRY FRUITS, CASHEW NUT FOR KAJU KATLI, K...",grocery & gourmet foods,https://m.media-amazon.com/images/I/71VMFSrfvDL._AC_UL320_.jpg,600.0
"Indiana Mix Seeds Charmagaz 400g (Cucumber Seeds, Watermelon Seeds, Sunflower Seeds, Pumpkin Seeds)",grocery & gourmet foods,https://m.media-amazon.com/images/I/71bFtEVepeL._AC_UL320_.jpg,300.0
Jagdish Farshan Fulwadi Namkeen || Healthy and Hygienic || Delightful Ready to Eat || 250 GMS Pack of 4,grocery & gourmet foods,https://m.media-amazon.com/images/I/71tYiT4jAQL._AC_UL320_.jpg,381.0
Nature Connect Pistachios Without Shell - | Pista 250 gram,grocery & gourmet foods,https://m.media-amazon.com/images/I/617XsHFaGfL._AC_UL320_.jpg,600.0
Ambrosia California Whole Almonds 250g |100% Natural | New Crop (Pack of 4),grocery & gourmet foods,https://m.media-amazon.com/images/I/61nbNsQChxL._AC_UL320_.jpg,1600.0
"Karachi Bakery Osmania Biscuit Premium Pack, 400g (Pack of 2)",grocery & gourmet foods,https://m.media-amazon.com/images/I/61nJZoFITGL._AC_UL320_.jpg,440.0
Shree Saatvik Hing Goli | Digestive Pills Churan,grocery & gourmet foods,https://m.media-amazon.com/images/I/61phTJnLQpL._AC_UL320_.jpg,115.0
"Nutty Gritties Southern Pepper Cashew Nuts ((Pack of 4-21g Each), 84g)",grocery & gourmet foods,https://m.media-amazon.com/images/I/81MpPrZM9XL._AC_UL320_.jpg,180.0
"Sapphire Choco Chip Cookies, 150 g",grocery & gourmet foods,https://m.media-amazon.com/images/I/51eETcdGyNL._AC_UL320_.jpg,175.0
"Nutty Yogi Masala Chai Gud 500 gm I 100% Natural I Boosts Immunity I Low GI I Unique Taste I Indian Ethnic I Pepper, Ellai...",grocery & gourmet foods,https://m.media-amazon.com/images/I/61Yowii+RfL._AC_UL320_.jpg,399.0
FOODHOLIC Sweet brand Saunf/ Meethi Sounf/ Paan Churi/ Fennel/ Mukhwas Variety and Mouth freshener (200 GR),grocery & gourmet foods,https://m.media-amazon.com/images/I/51Ilov9CRkL._AC_UL320_.jpg,299.0
Neeraj NatureHerbs Ekakshee/Ekakshi Nariyal/One Eye Coconut for Pooja,grocery & gourmet foods,https://m.media-amazon.com/images/I/81l2dKt7wHL._AC_UL320_.jpg,551.0
Seasonal Kart Flavoured Borkut | 250 gm | Mukhwas | Real Taste of BOR | Homemade & Tasty| (Borkut Ladoo),grocery & gourmet foods,https://m.media-amazon.com/images/I/71B-CYOy3TL._AC_UL320_.jpg,300.0
"Lemor Nylon Sev (400 GMS, 2 Packets of 200 GMS Each) | Pure Besan Namkeen Snacks for Foodie Indians |",grocery & gourmet foods,https://m.media-amazon.com/images/I/71uPE-2x3JL._AC_UL320_.jpg,360.0
NUTIBLES Puja Supari (Betel nut) 250gm,grocery & gourmet foods,https://m.media-amazon.com/images/I/31AwFe1SJUL._AC_UL320_.jpg,670.0
"Nature Krafts Anjeer [Dried Figs] - 1kg Big Size Anjeer Afghanistan Anjir (Fig Anjeer, 1kg)",grocery & gourmet foods,https://m.media-amazon.com/images/I/710YZTFGpwL._AC_UL320_.jpg,999.0
"Possible Chocolate Brownie Cookies | Choco Cookies | Delicious Fresh, Crunchy and Nutritious Grain Cookies | Gourmet Snack...",grocery & gourmet foods,https://m.media-amazon.com/images/I/61skIv59vgL._AC_UL320_.jpg,405.0
"SAARA : Sabja Seeds l Basil Seeds,100 gm",grocery & gourmet foods,https://m.media-amazon.com/images/I/818ONL+BS5L._AC_UL320_.jpg,125.0
"JEWEL FARMER Premium Dates with Dietary Fiber & Protein, Pack of Cholesterol Free Nutritious & Fresh Dried Khajoor (400g)",grocery & gourmet foods,https://m.media-amazon.com/images/I/61S4MFSWiwL._AC_UL320_.jpg,299.0
"FlowerAura Delectable Black Forest Treat Delicious Cake Gift's For Birthday, Anniversery, Valentine's Day, Mother's Day, P...",grocery & gourmet foods,https://m.media-amazon.com/images/I/61IExdzmI8L._AC_UL320_.jpg,1999.0
Joyable Khakhra - Pack of 4 (Assorted Flavors),grocery & gourmet foods,https://m.media-amazon.com/images/I/81+xqnUMdrL._AC_UL320_.jpg,300.0
Delicious Chalia Supari Selected (100G x Pack of 2),grocery & gourmet foods,https://m.media-amazon.com/images/W/IMAGERENDERING_521856-T1/images/I/91m98X5ghML._AC_UL320_.jpg,338.0
"Wooq Organics Premium Pine Nuts Without Shell 100g, Chilgoza big size",grocery & gourmet foods,https://m.media-amazon.com/images/W/IMAGERENDERING_521856-T1/images/I/71LQJ-Gm-NL._AC_UL320_.jpg,1099.0
Nature Prime Roasted Flax Seeds for Eating [Heart Healthy Flax Seeds] (250 Gm),grocery & gourmet foods,https://m.media-amazon.com/images/W/IMAGERENDERING_521856-T1/images/I/81TN8xW5ALL._AC_UL320_.jpg,500.0
SAARA Chia Seed / Raw Chia Seed / Diet Food / Healthy Snack 50g,grocery & gourmet foods,https://m.media-amazon.com/images/W/IMAGERENDERING_521856-T1/images/I/71eKW1YEVzL._AC_UL320_.jpg,106.0
"Maanki Dry Fruits Sugarfree Dates Barfi ( Khajoor Dryfruit Chikki ),250 gm",grocery & gourmet foods,https://m.media-amazon.com/images/W/IMAGERENDERING_521856-T1/images/I/81VxSGMc4hL._AC_UL320_.jpg,449.0
"Pringles Texas BBQ Sauce Chips Pop & Go, 40 g",grocery & gourmet foods,https://m.media-amazon.com/images/W/IMAGERENDERING_521856-T1/images/I/71+XEbV3DmS._AC_UL320_.jpg,250.0
Cocosutra GIANT Gourmet Cookies – 100g each | 4 Ooey Gooey Melty Flavors | Box of 4 Signature Cookies | Freshly Baked Prem...,grocery & gourmet foods,https://m.media-amazon.com/images/W/IMAGERENDERING_521856-T1/images/I/71QtxMm93pL._AC_UL320_.jpg,668.0
"Royal Dansk Butter & Choco-Chip Cookies 340g || Danish Cookies from Denmark in Iconic Blue Tin || Cookies for Tea Time, Sn...",grocery & gourmet foods,https://m.media-amazon.com/images/W/IMAGERENDERING_521856-T1/images/I/81YidyhbQaL._AC_UL320_.jpg,550.0
"Foodery Afghani Anjeer Figs - Afghanistan Dry Anjir ( Dried Figs ) Dry Fruits for body mass loss, Good for Physical Healt...",grocery & gourmet foods,https://m.media-amazon.com/images/W/IMAGERENDERING_521856-T1/images/I/81nI1b4auhL._AC_UL320_.jpg,999.0
"Hey Grain Almond Biscotti Cookies (Whole Grain Wheat Flour, Almonds, Demerara Sugar, Canola Oil, Salt, Baking Powder, Egg)",grocery & gourmet foods,https://m.media-amazon.com/images/W/IMAGERENDERING_521856-T1/images/I/61vQ9vP4LlL._AC_UL320_.jpg,155.0
"ORGANIC FARMS Kimia Juicy Dates (1.5kg -2kg) ,Buy2 Get 1Free, Pack of 3 offer, Fresh Dates | Kimia Dates | Organic dates |...",grocery & gourmet foods,https://m.media-amazon.com/images/W/IMAGERENDERING_521856-T1/images/I/51A7WbhImDL._AC_UL320_.jpg,999.0
Truefarm - Organic Roasted Peanuts (250g) | Slow Roasted Mungfali Dana | Source of Good Fats | Manganese Rich | Dry Roaste...,grocery & gourmet foods,https://m.media-amazon.com/images/W/IMAGERENDERING_521856-T1/images/I/81rzKFjK2aL._AC_UL320_.jpg,150.0
"Khari Foods Seedless Whole Dried Berries, Healthy Snacks, Fiber Rich, Highly Nutritional, No Added Sugar (Blackberries 250g)",grocery & gourmet foods,https://m.media-amazon.com/images/W/IMAGERENDERING_521856-T1/images/I/71vQjgiQzFL._AC_UL320_.jpg,599.0
advancedestore Chekkalu/Spicy Rice Crackers- ((250gm)),grocery & gourmet foods,https://m.media-amazon.com/images/W/IMAGERENDERING_521856-T1/images/I/61YDtB+j9aL._AC_UL320_.jpg,350.0
Haldiram's Naagpure Soya Sticks 200gm PACK of (4),grocery & gourmet foods,https://m.media-amazon.com/images/W/IMAGERENDERING_521856-T1/images/I/61OPdpHS8hS._AC_UL320_.jpg,180.0
"Happilo Rose Almonds Healthy Dry Fruit Energy Bar Pack of 12 (15g each), Healthy Snack, High in Protein Nuts, No Added Sug...",grocery & gourmet foods,https://m.media-amazon.com/images/W/IMAGERENDERING_521856-T1/images/I/71CG5KlVu9L._AC_UL320_.jpg,360.0
Organic Nature Dry Homemade Sabudana (Sago)KHICHIYA PAPAD | SABUDANA KHICHIYA (Pack of 250 Gram),grocery & gourmet foods,https://m.media-amazon.com/images/W/IMAGERENDERING_521856-T1/images/I/71mTs6BcCYL._AC_UL320_.jpg,199.0
The Paratha Falhari Sabudana Kurkure Alu Chakli Fried Sabudana Potato Chakli for Upwas Snacks farahal/Upwas Chips (1_KG_Va...,grocery & gourmet foods,https://m.media-amazon.com/images/W/IMAGERENDERING_521856-T1/images/I/71oYf73zTDL._AC_UL320_.jpg,649.0
Nutribee 100% Whole Wheat Atta Rusk - Chilli Garlic | Refined Sugar-Free | Healthy Diet Toast | No Maida and Sugar | No Pr...,grocery & gourmet foods,https://m.media-amazon.com/images/W/IMAGERENDERING_521856-T1/images/I/81jQtB4tCXL._AC_UL320_.jpg,270.0
Shudh Online Combo of Dry AMLA + BAHEDA + HARAD (200 grams each),grocery & gourmet foods,https://m.media-amazon.com/images/W/IMAGERENDERING_521856-T1/images/I/71d1DeO9juL._AC_UL320_.jpg,400.0
"Garden Pop-Pan Spring Onion Crackers, 200g,Green,0985",grocery & gourmet foods,https://m.media-amazon.com/images/W/IMAGERENDERING_521856-T1/images/I/91g5ieqXv3L._AC_UL320_.jpg,325.0
Takis Blue Heat Rolled Chips 113g (Pack Of 2),grocery & gourmet foods,https://m.media-amazon.com/images/W/IMAGERENDERING_521856-T1/images/I/71lvgsCB2GL._AC_UL320_.jpg,1599.0
"GOTREY Afghani Anjeer Figs -250gm Afghanistan Dry Anjir ( Dried Figs ) for body mass loss, Good for Physical Health, Incre...",grocery & gourmet foods,https://m.media-amazon.com/images/W/IMAGERENDERING_521856-T1/images/I/81nOvivx09L._AC_UL320_.jpg,499.0
Nature Connect Turkish Dried Apricot Dry Fruits 250 gms| Dried Apricot Soft and Big Size Khumani | Apricots with Jar |apri...,grocery & gourmet foods,https://m.media-amazon.com/images/W/IMAGERENDERING_521856-T1/images/I/71HQld0646L._AC_UL320_.jpg,399.0
Malpani's Bakelite Cafe Latte Cake (Coffee Cake),grocery & gourmet foods,https://m.media-amazon.com/images/I/61oP8YonULL._AC_UL320_.jpg,360.0
"NUTRIGRASS Whole Cashew Nuts Kaju, Jar Pack 250g",grocery & gourmet foods,https://m.media-amazon.com/images/I/81Gr3bxYbXL._AC_UL320_.jpg,500.0
BOGATCHI Pani puri packet ready to eat - Fry or Bake in Microwave | instant pani puri pellets | Golgappe Packet Readymade...,grocery & gourmet foods,https://m.media-amazon.com/images/I/718BzuAgjmL._AC_UL320_.jpg,349.0
"Organic Orchard Plain Coin Sabudana Sago Homemade Papad Gluten-Free, Upwas Snacks Tapioca Ready to fry (400 gram)",grocery & gourmet foods,https://m.media-amazon.com/images/I/513UsNPkp4L._AC_UL320_.jpg,779.0
"7 chakras ORGANIC(200g) Dried Goji Berries ( Gluten Free, Vegan & NON GMO ) Organic Goji berry Dry Fruits 200 gm",grocery & gourmet foods,https://m.media-amazon.com/images/I/71ddeuQ0urL._AC_UL320_.jpg,399.0
"Fruitri California Light Broken Walnuts Without Shell, Light Golden Akhrot Giri , 500gm",grocery & gourmet foods,https://m.media-amazon.com/images/I/613WoAc0kAL._AC_UL320_.jpg,799.0
Nourish Organics Honey Roasted Almonds 100Gr,grocery & gourmet foods,https://m.media-amazon.com/images/I/61TZEl4iqCL._AC_UL320_.jpg,300.0
Nature's Trunk Watermelon Seeds | Tarbooj ke Beej / Pucha Ginjalu | Magaj Seeds | Raw Watermelon Seeds for Eating | Diet F...,grocery & gourmet foods,https://m.media-amazon.com/images/I/719SVPHSfVL._AC_UL320_.jpg,490.0
"Nature Vit Sunflower Seeds for Eating, 5 Kg (1 Kg x 5 Packets)",grocery & gourmet foods,https://m.media-amazon.com/images/I/81QNgBWKqeL._AC_UL320_.jpg,2500.0
Purani Dilli Se Anjeer/Figs Dried Premium AAAAA (200gm),grocery & gourmet foods,https://m.media-amazon.com/images/I/71GujcSG-KL._AC_UL320_.jpg,1158.0
"LUSKA Kanyakumari Banana Chips, 400 grams, Authentic Nendran Plantain Chips (400g)",grocery & gourmet foods,https://m.media-amazon.com/images/I/81M5H66XQSL._AC_UL320_.jpg,700.0
"DHRUV Gold Afghani Abjosh | Munakka, 500g (Pack of 2x250Gm)",grocery & gourmet foods,https://m.media-amazon.com/images/I/A12FL2wEHrL._AC_UL320_.jpg,598.0
Pringles Texas BBQ Sauce - Pringles - 165g,grocery & gourmet foods,https://m.media-amazon.com/images/I/61TBkq9m3+L._AC_UL320_.jpg,399.0
PAANSMITH DRY PAAN 170g - HEALTHY DIGESTIVE | DRY PAAN | AFTER-MEAL | Mouth Freshener,grocery & gourmet foods,https://m.media-amazon.com/images/I/51viZ0uCISL._AC_UL320_.jpg,199.0
"Ryvita Multigrain Crunchy Rye Breads 6 Packs of 4 Slices,250g",grocery & gourmet foods,https://m.media-amazon.com/images/I/61Jf5VWz4aL._AC_UL320_.jpg,999.0
Anuvan™ Feel The Utsav Indori Namkeen Green Chatpata Matar -500 GM - उत्सव इंदौरी नमकीन हरा चटपटा मटर -500 GM……,grocery & gourmet foods,https://m.media-amazon.com/images/I/41awCgVppEL._AC_UL320_.jpg,499.0
"POLKA Pack of 3 , French Heart Puff , 350 X3= 1050 GM ,Gift Combo ,Gift Set ,Sweet Snacks , Sweet Puff",grocery & gourmet foods,https://m.media-amazon.com/images/I/816nQobrN1L._AC_UL320_.jpg,480.0
